topic,speech_id,party,sentiment,speech_date,prob,speech
2,ParlaMint-GB_2016-01-13-commons.u328,SNP,1.0,2016-01-13,0.0,"While we welcome the creation of any jobs, productivity is not just about paid employment—it is also about how people can contribute to society and what those from all sections of society can contribute, whatever their ability, race or gender. Investment in what has become known as our human capital and the engagement and happiness of our people should all be part of a rounded strategy. We must ensure that across the nations of the UK we can positively engage with our people, whatever their race, gender, sexuality or ability, in ensuring that they get the opportunity of good-quality, long-term sustainable employment and, with that, boost our productivity levels. We must operate in a society where inclusiveness and diversity are central I recently met members of the Scottish Centre for Voluntary Organisations who spoke of the work they are doing on how we look at employability and productivity. The SCVO has undertaken extensive work on taking a rounder view of the contribution that people can make to Scotland’s economy. It is exploring the notion that being productive is not just about being in full-time, well-paid employment but about what kind of contribution people across the social spectrum can make as volunteers, activists or carers, to name but a few examples I do not think we would find any disagreement across the House, or indeed in society, about the fact that not everyone can always be in full-time paid employment. Many women, in particular, will take a break from their careers to have children; men may take a break to share parental care; and many men, although generally more women, may have to take time out later in their careers to care for elderly parents or relatives. These breaks may result in a change of career direction, the setting up of one’s own business, or long-term care of a child or elderly parent. Whatever the case, these roles all play an important, and indeed productive, part in an inclusive society I reference the experience in my own family. When my sister-in-law returned to work after having her first child, she could not get the flexibility in her work that she would have liked. She set up her own photography business and decided to go full time with it. I am sure that we all have across our constituencies such cases of women—and men—starting their own businesses because they could not find the flexibility in the workforce that they would have liked For some women, these breaks or diversions in their working life can often have detrimental impacts on pay and progression. We have debated and discussed much in this House the reasons and remedies for the gender pay gap. In the UK, the gender employment gap is currently 10 percentage points, but I am pleased to say that the gender employment gap in Scotland has narrowed from 10.6 to 6.3 percentage points since 2007. That is evidence that a greater sense of equality, inclusiveness and egalitarian values are helping in many areas of Scottish society How we innovate—not only in technology, but in our workforce—is of critical importance if we are to drive up productivity. We must work hand in glove with businesses and create the circumstances in which they can flourish, innovate and develop. No Government or policy maker has a monopoly on wisdom or a silver bullet, but listening and engaging must be at the forefront of our minds as we set policy and create legislation Many Members have spoken about the oil and gas industry and the challenges that it currently faces. Before I came into politics, my last professional job was in the oil and gas sector in Aberdeen. As I have often done recently, I think today of my friends and former colleagues whose jobs are under threat or those who have already lost their jobs. I urge Members on both sides of the House to put aside politics, where appropriate, and look at constructive ways in which we can help the industry I learned a great deal in one of my roles working in an oil and gas company. It was partnered with a Scottish technological company, which was a spin-off from Heriot-Watt University. Its technology provided the intelligence for an autonomous underwater inspection vehicle, while the company I worked for provided the hardware and investment. To give the House a brief flavour of the technology’s potential use, there was a significant gas leak offshore while I was in that role. If that technology had been advanced enough, it could have been used to stop the leak much sooner. It was stopped only when it was finally safe for humans to go in and fix the issue manually It is some time since I left that role, but I recall that the Scottish tech company was acquired by an American firm shortly after my departure. Such tales are all too familiar across the UK. I am sure all involved felt that it was a positive move, but I would like to think our historical reputation in Scotland as a great nation of innovators means that our developing tech firms will not see acquisition by American firms as a trademark of success. I am sure we all hope that we can retain and develop as much home talent as possible. After all, in the words of American writer Arthur Herman, Scotland “invented the modern world”. From the television to the telephone, penicillin and even the overdraft, we are a proud nation of innovators. Every day, in labs, workshops, offices and classrooms, the imaginations of our young people, academics and entrepreneurs are innovating and designing products that may be tomorrow’s solution to some of our greatest challenges, so why can we not bridge the gap between ideas, academic excellence, innovation and productivity The world rankings for universities were released yesterday. With Scotland hosting three of the world’s leading universities and the UK overall hosting 18 of the world’s top 100 universities, we punch above our weight as a family of nations. Yet at a recent CBI round table discussion I attended, the issue of the day—why productivity was lagging—had many scratching their heads, given how well the UK does in academia. I suggest that financing, access to funds and this Government’s failure to listen on funding for innovation has something to do with the challenges that the UK faces We have discussed manufacturing and the need not only to continue to drive it, but to modernise. For the steel industry in particular, the Scottish Government have invested and done all they can to protect jobs in that sector. We hope that the UK Government will continue to push the EU on energy tariffs Carolyn Fairbairn, the director general of the CBI, has said that “the shift from grants to loans for Innovate UK could dampen bold and game changing innovation, particularly amongst smaller businesses.” In Scotland, we have the example of CodeClan, which is supported by the Scottish Government. It encourages young people or people retraining to come into the area of coding. In Scotland, output per hour has grown 4% since 2007, compared with zero growth in UK productivity during the same period. The result is that Scottish productivity has caught up significantly with UK levels, rising from 92% of the UK average in 2007 to 98% in 2013. These trends are encouraging, and the Scottish Government are committed to improving them further, with measures such as the living wage, the Scottish business pledge and more encouragement for businesses to focus on improving productivity We have many great examples of companies innovating and deploying their expertise in the UK or exporting across the globe, but we must sustain investment to encourage more to do so. Among such companies are Craneware in Edinburgh, which specialises in software for healthcare billing, and Waste Switch Ltd in my constituency, which is engineering and designing innovative waste management systems across the UK. We could all cite a raft of fantastic local and national success stories, but we must work together to ensure that we create the right policies and an environment in which businesses and people can innovate, export and boost productivity In her book, “Difference Works”, Caroline Turner argues that “retention, productivity and profitability can be boosted through inclusion.” Arianna Huffington, the founder of The Huffington Post, wrote compellingly in her book, “Thrive”, about the third metric and stated that redefining success was about: “Creating a life of well-being, wisdom and wonder.” I was particularly struck by her comments about the race to the bottom and the burn-out that are driven by male-dominated cultures, particularly in corporate business, which are about who can be in earliest and leave latest. It reminded me a little of this place If we are to succeed across the nations of the UK, we must put inclusive growth at the heart of our drive to innovate, be productive and narrow the widening export gap. Today, more than 100 disabled people will lobby Parliament about their concerns over the Welfare Reform and Work Bill, although I probably will not get there because I have been in the Chamber all day. Those people represent a very important section of society that contains unique perspectives, skills and talents. They may have a range of physical or other disabilities, but they are equal members of our society who can, and no doubt want, to play an active, engaged and productive role I feel passionately that whatever a person’s gender, race, sexuality or ability, they represent hope and opportunity in some form. Although some may not fit into this Government’s view of what productive work means or be able to tick a specific box, it does not mean that they cannot play an active and productive role. We must, across all party boundaries, work together to ensure that we have an inclusive society that gives everyone the opportunity to contribute and be productive."
2,ParlaMint-GB_2021-11-29-commons.u376,SNP,0.88232421875,2021-11-29,0.0,"In raising this important issue, I refer the House to my entry in the Register of Members’ Financial Interests, and to my position as chair of the PCS parliamentary group May I begin by saying a few words about a personal matter? Today would have been my grandfather’s 99th birthday. My grandfather was a keen supporter of the Scottish National party, and, indeed, voted for it every time it featured on the ballot paper. He was a great influence on me, in ensuring that politics was discussed and debated. I want to pay tribute to my grandpa, and to thank him for everything he did for me. I hope that he is proud of me. He was of course a public sector worker too, and I am sure he would approve of the fact that I am raising the issue of public sector pay this evening The covid-19 pandemic has presented the United Kingdom with its biggest national crisis in decades. Workers in the civil service and its related areas have risen to the challenge, and have rightly been lauded as heroes by the Government. Plaudits, however, are not enough. Those workers have faced over a decade of pay freezes and pay caps which have seen their living standards fall by about 20% in real terms I am sure we will hear the Minister say that austerity is necessary in order to manage public finances, so let me start by putting that myth to bed. Austerity has done enormous harm to the public finances through the strangulation of living standards, investment and economic growth. It is a policy widely recognised by every reputable economist as a complete and utter failure, and workers in the civil service have been hit particularly hard by that failure. A study by Dr Mark Williams of the University of Surrey in 2018 found that average annual growth in median pay in the civil service had been up to 1.9% below inflation since 2010; that the erosion of pay in the civil service had been greater than in the rest of the public sector and that it had fallen up to 11.4% behind the rest of the public sector since 2010; and that women had been particularly hard hit, with the gender pay gap standing at 12% Let us not attempt to explain this away with false comparisons with workers in other sectors, or with references to the national finances and the economy. In my view, Ministers constantly change their position on this issue when it suits them. If borrowing is up, they say that they cannot afford pay rises, and if inflation is going up, they say the same. Despite the squeeze on living standards, private sector wages are going up, but they simply ignore that comparator. The Government need to stop doing this, and start taking responsibility for the welfare of the staff I happen to believe that the Government’s approach has been a disaster, particularly for workers on low pay. They cannot claim to want a high-wage civil service while Departments scramble around on an annual basis to find the funding to raise pay levels to the minimum wage. During the pandemic, they laud civil servants as heroes, but their pay policy makes them paupers. There is little doubt that civil servants have become the poor relations when it comes to pay in the public sector, and it is frankly disgraceful that the Government should treat their own workforce in this manner."
2,ParlaMint-GB_2016-05-19-commons.u226,SNP,0.875,2016-05-19,0.0,"That is a very important point, and I am delighted to underline it and to ask the Secretary of State to respond. We see this development as having great possibilities and we would anticipate that, when making their decision, the UK Government will fully appreciate the excellent potential sites in Scotland. We encourage the UK Government to work with the Scottish Government, Scottish local authorities and our public agencies to realise this potential in Scotland We would also welcome more detail on developing a genuine aerospace strategy, which must include supporting the industry to address the skills gap in the engineering sector. I urge Ministers to consider some of the work on gender-balance issues. Not long ago in the Chamber I quoted Bridget Day, the deputy director of the national aerospace programme with more than 40 years’ experience. She has highlighted her struggles as a woman in the industry. Only 11% of engineers are women, even though more than 20% of graduates are women. That is the lowest percentage of female employment in the sector across Europe There are also apprentice opportunities in shipping—transport should include references to shipping. The Scottish Government worked tirelessly, as they did on the Scottish steel issue, to save the iconic Ferguson shipyard, which is vital to providing vessels and employment for the future. Of course, this place has decided to delay the BAE order for the Govan and Scotstoun yards with the review of shipbuilding. That delay threatens jobs in Scotland and I hope that Ministers will take that message back to the Cabinet and get the Treasury to release the brakes on that development On the subject of shipping, we also have an opportunity to put right the dangerous deficit that has been allowed to continue around the seas of the UK, nowhere more strikingly than on the west coast of Scotland. My right hon. Friend the Member for Moray (Angus Robertson) has highlighted on many occasions the dangers and folly of removing maritime patrol aircraft from Scotland, but when the removal of one of Scotland’s two emergency towing vessels and the ongoing uncertainty over the remaining tug are added to that, it is easy to see why Ministers are facing calls from every quarter to commit to permanently securing the remaining vessel and reinstating the second. Those vessels, if deployed sensibly, can assist drifting ships, therefore preventing them from running aground, and head off disaster, protecting human lives and fragile environments. They are called emergency towing vessels for a simple reason: they are available for emergencies, such as when they were called in to rescue one of the UK’s nuclear submarines that had run aground off Skye. Their retention and reinstatement has been strongly urged by everyone who understands the risks from the seas around Scotland—the marine industry, marine unions, including Nautilus, every highlands and islands MP and MSP, local authorities and agencies. They have all pointed out that we cannot wait for a disaster to happen before there is a reaction, so protection is needed so that a disaster can be prevented The nations of the UK need not just warm words of support for good ideas, but a connectivity strategy: a plan for air; a plan for technology; a plan for suitable sustainable fuels; a plan for marine operations; a plan for health and wellbeing; a plan for tourism; a plan for trade and enterprise; and a plan for productivity. We must see more and better work from the UK Government on those fronts"
2,ParlaMint-GB_2018-10-30-commons.u361,SNP,-0.94287109375,2018-10-30,0.5770073505526642,"An end to austerity cannot come soon enough. It is disappointing that the Chancellor chose yesterday just to kick the can down the road, and that he has committed only to starting to end austerity—maybe—in a spending review next year. Families and children in my constituency cannot wait until then; they have waited long enough The Chancellor says that this is a Budget for hard-working families. I take issue with that term because we should not judge people on such a basis. Many families cannot work because of their circumstances and feel stigmatised by the “strivers and skivers” narrative that the Government continue to use. However, universal credit means the disgraceful reality that many families are actually in work but still facing poverty. Cuts to universal credit mean that they will not be able to work themselves out of that poverty trap That situation is compounded by the Chancellor’s pretendy living wage, which leaves 16 and 17-year-olds facing an increasing age pay gap. In 2017, the gap between the pretendy minimum wage and the rate for 16 and 17-year-olds was £3.45 and this year it was £3.63. Next year their rate will £3.86 less, but 16 and 17-year-olds still have the same bills to pay. They can be in the same job and doing the same task as somebody on the higher rate, but this Government do not value their labour, which is an absolute disgrace The reality is that the UK Government’s cuts will see welfare spending in Scotland cut by 3.7 billion. The Scottish Government are trying really hard and making changes to make the system fairer in the limited way we can, but we are working with one hand tied behind our back My constituency voted for independence in 2014 and to stay in the EU in 2016. We did not vote for austerity, and we did not vote for the choices this Tory Government are inflicting on us. This Government are doing nothing to convince these voters that their vote in 2016 was wrong. Acknowledging that austerity should be over, but taking no action to end it is a disappointing move for even the most hardened of cynics, and the possibility of crashing out of the EU without a deal fair focuses the mind Economic policy is not just about adding pennies here and there on fuel and alcohol but about the building blocks of what we want our society to look like. Austerity embeds inequality—there is no safety net for people who find themselves on hard times, and people feel punished for being disabled—and this is no way to build a fairer society. The UK Government also fail to acknowledge that austerity is gendered and discriminatory at its very core. The Government should be looking at inclusive growth policies to increase wages and to engage women in the labour market, but they are not doing so Women are more likely to claim benefits. This is not because they are lazy or workshy, as the “strivers and skivers” narrative would have us believe, but because a societal expectation still exists that women will look after the children, the elderly and the sick. Even now, the majority of unpaid labour is almost always performed by women. When benefits are cut, it is frequently women who will go hungry to make sure their children are fed. Women also go into low-paid and part-time work to meet their caring obligations What did the Government do? They cut and they cut and they cut. We have seen huge cuts to breastfeeding support across England. I mention that because it leaves women with very little choice. If they want to breastfeed and do not get support for that, they are forced to buy infant formula, but infant formula has risen in price by 9.6% since the Brexit vote. With real-terms cuts to benefits, where are these women supposed to find the extra money? Healthy Start vouchers have also not kept pace with the increase. On top of that, if the baby happens to be the third child born into a family, that family will now be nearly £3,000 a year worse off because of the two-child cap on universal credit. Something so arbitrary as the order children are born in should not affect their chances in life A freeze on fuel duty does not help many working families or those with caring obligations who are still struggling to make ends meet. People on very low incomes often do not own cars—in Glasgow, 51% of households do not have access to a car. Nor are people on very low incomes likely to benefit from an increase in the personal allowance, because they do not earn enough. Two thirds of them are women. What is the Chancellor going to do to help those women Some 3,400 women in my constituency are affected by the increases to the state pension age. These women have a contract with the state, and the UK Government are not holding up their end of it. Some parts of my constituency still have a life expectancy that is below average. That is a legacy of previous Tory policies, which forced people into poor life choices. Most people affected by this pension policy will not even live long enough to get the full benefit of their state pension The impact of this policy is starting to show in the statistics. The recent annual survey of hours and earnings showed that the gender pay gap for over-60s had increased by nearly 3% in a year. WASPI women are having to postpone their well-deserved retirement and take up low-paid jobs just to keep their heads above water. Austerity means difficult choices for the lowest earners in our society. People are at risk of getting into debt to feed their families, pay rent or buy Christmas presents for their kids during the five-week wait on universal credit. As I have said in this place before, somebody making a claim in Shettleston jobcentre when universal credit rolls out on 5 December will be without money until 9 January—a cold, lonely Christmas, with no money coming in. The response of the Chancellor and DWP Ministers is to say, “It’s okay. They can get a loan.” People in my constituency do not want more debt; they want fair wages and a high standard of living, and they do not want to be dragged down by this Government’s policies Funding for managed migration does not help the people who will be part of the roll-out on 5 December in Calton. These people will miss out if there are any managed migration funds. That is why universal credit must be paused now. I am begging Ministers to look at this, because I do not want children in my constituency going with nothing at Christmas Austerity will not be over until the benefit freeze is lifted, the two-child cap is abolished and there is a focus on policies that actually increase wages. Last week I called on the Chancellor to end the benefit freeze. The Tories have rightly received harsh scrutiny over universal credit, but the benefit freeze could be just as damaging to low-income families. The Institute for Fiscal Studies has estimated that, by 2020, it will cost families as much as £800 a year There is a huge disparity here. The Government have a choice between big businesses, tax cuts and low earners, and their priorities have been made perfectly clear in this Budget, which does nothing for so many people in this country and will put them further in poverty."
