topic,speech_id,party,sentiment,speech_date,prob,speech
7,ParlaMint-GB_2019-03-07-commons.u411,LAB,0.77587890625,2019-03-07,1.0,"It is a pleasure to follow the hon. Member for Glasgow North (Patrick Grady). It is also a pleasure to speak for the Opposition in this important debate in this, the 70th year of the Commonwealth Many excellent speeches and points have been made about the opportunities and challenges that face the Commonwealth. The hon. Member for Rochford and Southend East (James Duddridge) made the point about the important work of the CPA in ensuring our good relations with the Commonwealth My hon. Friend the Member for City of Durham (Dr Blackman-Woods) talked about the need to keep up the momentum following CHOGM 2018, and to harness that into a revitalised Commonwealth fit for the 21st century. She also talked about the involvement of women in Parliaments The right hon. Member for East Devon (Sir Hugo Swire) talked about the growth in the economies of Commonwealth countries and Rwanda’s particular commitment to gender equality, which is very appropriate in the light of the fact that it is International Women’s Day tomorrow. My right hon. Friend the Member for Delyn (David Hanson) raised issues relating to sustainability, climate change, poverty, cyber-security and modern slavery, to name just a few The right hon. Member for Witham (Priti Patel) talked about the changing face of the Commonwealth and the fast-growing economies of some of its countries, particularly India. My hon. Friend the Member for Bristol East (Kerry McCarthy) talked about the urgent need to tackle climate change and plastic pollution, and about the adoption of the Commonwealth blue charter The hon. Member for Gloucester (Richard Graham) gave us a tour of the different gifts given to this place by Commonwealth countries, thereby highlighting the special nature of our relationship. The hon. Member for Strangford (Jim Shannon) focused on the persecution of Christians in some Commonwealth countries and the need to concentrate on ensuring that rights to freedom of religion or belief are not further eroded but are addressed using our Commonwealth partnership and power The Commonwealth encompasses a diverse range of countries, and I wish to inject a cautionary note into the talk about increasing our trade with the Commonwealth. Let me use Australia as an example. Australia has become a much more multicultural nation, with 46% of the population either born overseas or having one parent who was born overseas. The Australian population looks at a post-Brexit world through the lens of an increasingly non-British-affiliated population. Many Australians see the future of their country as being focused on Asia rather than the UK, as evidenced by the recent free trade agreement with Indonesia. Although our cultural ties with Australia are still strong, Australia’s economic focus appears to be elsewhere Despite the CHOGM in London last year being the first to be held since the Brexit vote, there was no notable movement or declaration on the issue of trade between Commonwealth countries. Given that the Brexit campaign asserted that increased trade with the Commonwealth could help to alleviate the economic impact of leaving the EU, that seems to me to be a notable omission Despite the Prime Minister’s high-profile speech at the summit, in which she apologised for the colonial imposition of anti-LGBT laws that still persist in many Commonwealth countries, there was no follow-up agreement among attendees to do away with those laws or, indeed, to begin to address the discrimination faced by the LGBT community in many Commonwealth countries The Commonwealth’s annual theme for this year, 2019, is, “A connected Commonwealth”. That theme encourages collaboration among the people, the Governments and the institutions of the Commonwealth to protect natural resources and promote inclusive economic empowerment so that all people—particularly women, young people and marginalised communities—can benefit equally. That builds on the goals agreed at CHOGM 2018, most notably adopting the Commonwealth blue charter on sustainable development and protection of the world’s oceans; committing to ratify and implement the convention on the elimination of all forms of discrimination against women; and the adoption of the Commonwealth cyber declaration, with a common commitment to an open, democratic, peaceful and secure internet, respecting human rights and freedom of expression The Commonwealth faces many challenges: job creation, trade, ending absolute poverty, tackling climate change and making progress on achieving the sustainable development goals by the target year of 2030. Across the Commonwealth, we have ongoing human rights or instability issues in countries such as Bangladesh, Cameroon and Pakistan. We have had the recent clashes in Kashmir between Commonwealth partners India and Pakistan, and the recent violence and instability in Zimbabwe, which expressed the wish to be readmitted to the Commonwealth following the fall of Mugabe There are many challenges. Let us not forget the opportunities, but given that the size of our exports to all 52 Commonwealth countries in 2016 was similar to the size of our exports to one EU country—Germany— we have a long way to go before our trade with the Commonwealth even begins to compensate for the loss of our customs union with the EU."
7,ParlaMint-GB_2020-03-09-commons.u364,LAB,-0.869140625,2020-03-09,0.0,"I worked with the Commonwealth secretariat and I have worked at the United Nations on these issues, so I know exactly what the hon. Lady is referring to. However, the proof is in the pudding, and I am afraid that the pudding is going rotten—things are going backwards. The situation of LGBT rights in these countries is deteriorating, not improving. If this is all done through private discussions, which are important, those discussions are going very poorly. Perhaps there comes a time when gently—we do not have to embarrass people—we publicly say, “We don’t think enough progress has been made on this, and we would like to move forward.” It is important to say that all those countries have laws on their statute books because we imposed them. Those laws were not there before colonisation. In many of those countries, there was no legal discrimination and we imposed it. We have rightly seen our historical mistake and we have changed how we do things here, but we have a duty then to support others on the ground. It was right that the then Prime Minister, the right hon. Member for Maidenhead (Mrs May), apologised last year. It was a brave thing for the Government to do, but it is time now for actions. Not only did the Government fail to put LGBT rights on the agenda, but the communiqué from London failed to mention them even once. Let us contrast that with what happened at the Commonwealth youth forum, where LGBT rights were raised in the opening and in the calls for action."
7,ParlaMint-GB_2020-03-17-commons.u59,LAB,-0.87158203125,2020-03-17,0.5843189382493826,"Since June 2019, when the UK became co-chair of the Equal Rights Coalition to defend LGBT communities around the world, no additional Commonwealth countries have joined. Even now, there are no Commonwealth members from Africa, Asia or the Caribbean. What can the Minister do to improve that dire situation?"
7,ParlaMint-GB_2020-03-09-commons.u367,LAB,-0.89208984375,2020-03-09,0.253034546439133,"I had the privilege of being on the Commonwealth Parliamentary Association executive and of visiting Rwanda 18 months ago. One concern about the Rwanda CHOGM relates to press freedom. It was alarming that Senators and Members of Parliament, all of whom are very good people and who have made huge achievements on gender equality, including on women’s budgeting issues—I thought that was extraordinary, and we could have done it here many decades ago—still had an issue about allowing reporters and mainstream media into Rwanda, because they believed that those people were not reporting exactly as the President would like. That problem needs to be addressed at the CHOGM in Kigali."
7,ParlaMint-GB_2020-03-09-commons.u375,SNP,0.88916015625,2020-03-09,0.7140471448462173,"I congratulate the hon. Member for Bracknell (James Sunderland) on a passionate, and in some ways quite prescient, maiden speech. He has picked a pretty appropriate debate in which to make it, and I wish him and anyone else making a maiden speech today all the very best. Some of us were also elected at pretty short notice back in 2015, and it is absolutely appropriate to remark on the welcome we received from the support staff, the Doorkeepers and so on It is great that we are able to debate the future of the Commonwealth and Britain’s relationship with the Commonwealth on Commonwealth Day itself, as the service has been taking place in Westminster Abbey and as the House has agreed to the Second Reading of the Birmingham Commonwealth Games Bill. It is great to see the Minister in his place; I was looking back at Hansard and I do believe that he moved the motion in the debate on Commonwealth Day last year in Westminster Hall, as a Back Bencher—a debate in which I responded on behalf of my party. The debate is a little higher in profile today given that it is happening in the main Chamber The presence of the Earl and Countess of Dumbarton, making their last appearance in their current roles, has given a bit of added focus to the celebration in Westminster Abbey. We wish them all the best as they move on to pastures new. Another attendee in the abbey, as well as Mr Speaker, was the Speaker of the Malawian Parliament, the right hon. Catherine Gotani Hara, whom I had the immense privilege of meeting when I was in Malawi last year and with whom I enjoyed a very nice lunch this afternoon. The bringing together of such a number of different people from a number of different backgrounds and different parts of the world shows the effect of the Commonwealth The theme for Commonwealth Day in the year ahead is “Delivering a Common Future: Connecting, Innovating and Transforming”. It certainly will be a year—indeed years to come now—of innovation and transformation in the UK’s relationship with the rest of the world, and not necessarily for the better. I hope that Scotland’s constitutional future and international relations will also be transformed; I might say a bit more about that later It is worth reflecting, as others have, on both the history of and the recent developments in the Commonwealth. Last year’s debate was marked the 70th anniversary. That milestone has come and gone, but the institution continues to demonstrate its relevance and interests to the member states. We welcome, as others have, the readmission of the Maldives to the Commonwealth at the start of this month, following a period of internal democratic reform that resulted in its becoming the 54th member. That shows how the Commonwealth can be a force for good The UK’s term as chair-in-office is coming to an end, and the position will be taken on by Rwanda. As the shadow Minister remarked, that is unusual and a first, because Rwanda is not a former British colony. It is also a member of La Francophonie collection of nations, so it has a very interesting dual role Like the hon. Member for Ogmore (Chris Elmore), who made a brief intervention, I was on the delegation of the Commonwealth Parliamentary Association that was part of the preparatory work for Rwanda taking on the chair-in-office. We noted features of its democracy, including its high level of female participation and representation in Parliament, and its stable and growing economy—remarkable in that part of the world and given the country’s history. But there are also concerns around freedom of the press and freedom of participation, and it is right that such issues should be raised. The delegates at that conference will have much to learn and discuss I pay tribute more widely to the role of the Commonwealth Parliamentary Association. I was an executive member between 2015 and 2017, and found it a valuable experience. The CPA plays an important role in connecting parliamentarians, and promoting mutual learning, sharing and partnership. It does not simply say, “Look at what a great example we can set here in the United Kingdom”, but asks, “What can we learn from different Parliaments around the world?” I mean, a number of members of the Commonwealth still include hereditary members of the aristocracy in their legislatures —Tonga, Lesotho and a small island state known as the United Kingdom of Great Britain and Northern Ireland: it is not our job to go and lecture other members of the Commonwealth on the ideal models of democratic participation. We should all be in learning mode. One of the most celebrated features of the Commonwealth is, of course, the Commonwealth games, which leave a lasting legacy wherever they are held. I was taught to swim in the Commonwealth pool in Edinburgh, which celebrated its 50th anniversary in January. The 2014 games in Glasgow also left a lasting and visible legacy in that city. Over the period from 2007 to 2014, the games contributed £740 million to the city’s gross value added, so Birmingham has very much to look forward to in the years to come. I just hope that it gets weather as exquisite as we had for those two weeks in 2014, which has not been repeated As well as looking at the past, I want to look at the future, and how the institution will develop in years to come. I am not sure whether it has been touched on yet, but we cannot ignore questions about how the secretariat is funded, financed and run, because we have to keep the house of the institution in order. Failings in that area might lead some members—there are plenty of voices in Australia, for example—to question the value of the entire institution, which would be pretty unfortunate. That is why we have to look back to the principles of partnership, mutual learning and accountability The bigger challenge that the Commonwealth has faced, and which has been touched on, is the difference between the declarations and statements made and the ambitions that the Commonwealth has for itself, and then the reality in many of its member countries. It champions—and we want to champion—democracy and human rights, but there are gaps and standards that are not lived up to, and that is particularly true on the question of LGBT rights, about which the shadow Minister spoke so eloquently; I entirely agree with him I admit that Malawi—a country that I have close and fond relationships with—is behind the curve in recognising the rights and freedoms that the LGBT community should have. If the Commonwealth is to be a force for good and make a difference in the modern world, these are the kinds of issues that it must seek to address through its structures and among its membership. That brings me to the role of the United Kingdom and its relationship with the Commonwealth, and how it fits with the concept of a global Britain For all the undoubted value that the Commonwealth brings to its members, it can never be a substitute or alternative to membership of the European Union. The fundamental differences are clear even from the names of the organisations. The Commonwealth is about a shared heritage and shared ambitions. The European Union is a political, economic—and, yes, a social and cultural—union. Membership of the EU has delivered economic benefits that are simply not possible for our relationship with the Commonwealth to replicate. The relative size of the economy, the nature of the trade in goods and services, and the sheer facts of geography and requirements of transport, mean that no trading relationship with Commonwealth countries could match what we had with the European Union If the Government do want to strike ambitious trade deals with Commonwealth countries, there will have to be arrangements, and give and take, on both sides. India, for example, has already signalled that it would want to see an easing on visa restrictions and travel opportunities. Therefore, although Brexiteers might rejoice in the ending of freedom of movement within Europe, the reality is that modern trade relies on the movement of labour, irrespective of our trading partners. People will still want to travel as a consequence of any future trade deals that might be entered into What the Commonwealth certainly is not, and should not be thought of as, is some route back to the bygone days of an empire or Britannia ruling the waves. Even if some of the more extreme elements on the Tory Back Benches were to think this desirable, it would quite understandably be resisted by the other member states. When the UK Government try to brand these islands as “global Britain”, we have to ask how that reality matches the rhetoric, because even for Commonwealth countries—the countries with which we are supposed to have the most historic ties, which so many Brexiteers saw as somehow preferable to our historic European ties—access to the UK is limited and constrained. I, and colleagues who are with me in the Chamber, have repeatedly raised concerns about the ability of artists, academics and businesses to get visas—not to stay, settle down, take jobs away or cream off the welfare state, but just to access the country to attend conferences and cultural events—yet they still face massive and expensive bureaucratic hurdles When I was in Malawi last year, we went to visit the British high commission, and it was festooned with “Britain is GREAT” branding, and adverts saying, “Come to the United Kingdom and take part in the Chevening scholarships”. Yet the night before we had been discussing with young Malawian members of civil society the fact that they could not even apply for the Chevening scholarships because they were not getting their visas. We hear time and again of visitors who come here, invited by the British Council and by the Commonwealth Secretariat, and who are denied their visas and access to the United Kingdom. So the notion of Britain being open for business—of global Britain in some new, glorious era—simply does not match reality Nowhere is that clearer—again, I echo the shadow Minister on this—than on the issue of the visa charges for Commonwealth citizens who have served in the UK armed forces. When personnel who are Commonwealth citizens leave the UK armed forces and wish to apply to continue to live in the country that they have served for years, they face fees of thousands of pounds to do so. The Royal British Legion reckons that a service leaver with a partner and two children will be presented with a bill of almost £10,000 to continue to live in the UK, despite their years of sacrifice and service. Without leave to remain, these veterans are cut off from being able to access employment or state support, leaving them and their families reliant on charitable funds or facing repatriation to their country of origin. We wholeheartedly support the Royal British Legion and others who are campaigning for these fees to be scrapped for Commonwealth service leavers."
7,ParlaMint-GB_2020-03-09-commons.u369,SNP,0.7255859375,2020-03-09,0.19822839532920003,The shadow Minister is making an extremely good speech on gender equality. Does he agree that it is extremely important that we encourage and support Commonwealth countries to move forward and make progress on disability equality? That is an issue on which the Department for International Development in East Kilbride in my constituency is working hard. We should do our utmost in Parliament to champion movement on disability equality.
