topic,speech_id,party,sentiment,speech_date,prob,speech
4,ParlaMint-GB_2022-05-11-commons.u152,SNP,-0.791015625,2022-05-11,0.0,"I will develop my argument before I give way. I am concerned that Members are coming under pressure to support a ban on what is described as trans conversion therapy that ignores the interim report of the Cass review and the testimonies of Tavistock clinic whistleblowers and detransitioners. There is an exponential rise in the number of girls seeking to transition. Many of those girls will be same-sex attracted; it is important that that possibility, and other explanations for dysphoria, such as autism, be explored in a respectful way with a qualified therapist before young women embark on a road to medicalisation. If someone experiences gender dysphoria in childhood or puberty, it does not necessarily mean that they are trans. Thousands of adult lesbians and gay men will, like me, know that to be true. It is really important that Members understand that “trans inclusive” means assuming that all children who say that they are of the opposite sex are transgender. It also means insisting that they do not need psychotherapy if they say they do not want it Hilary Cass, former president of the Royal College of Paediatrics and Child Health, has been commissioned to report on NHS gender identity services for children. Her interim report, which was published a couple of months ago, has provided worrying information about the lack of normal clinical standards being applied to children with gender distress. More work needs to be done, but the interim results show that a high proportion of cared-for children, those with autism or experience of abuse, and children who would be likely to grow up lesbian or gay are presenting for gender services. I am advocating for evidence-based policy making. Let us wait for the outcome of the Cass report, and let us not be influenced by those who want to criminalise therapists who simply want to do their job and act in their patients’ best interests. We urgently need proper, informed debate, in public and in Parliament, and it must centre on the wellbeing of children and young people We can have such proper, informed debates in this place and beyond only if we have free speech. The Tories say that they believe in free speech and want to better protect it as a right, but actions speak louder than words. The Police, Crime, Sentencing and Courts Act 2022, which was passed in the previous Session, the Public Order Bill and the Online Safety Bill all contain potential threats to freedom of expression. One of the problems with the Online Safety Bill is the introduction of a “legal but harmful” category for the removal of content. It will create a situation in which people are prevented from saying things that are legal but prohibited. There is a significant danger that, as drafted, the Bill will lead to the censorship of legal speech by online platforms and give the Government unacceptable controls over what we can and cannot say online As a former sex crimes prosecutor, I completely applaud the desire to protect children online that underlines the Online Safety Bill, but I am worried that the “legal but harmful” category will enable vexatious complainants to exploit the lack of definitional clarity to try to shut down lawful speech on topics of public concern on the grounds that it is “harmful” and should be subject to censorship."
4,ParlaMint-GB_2016-12-01-commons.u306,SNP,-0.83056640625,2016-12-01,0.0,The Committee heard from individuals who had gone through harrowing experiences. They had gone to quite extreme lengths to receive the treatment that they wanted in order to have their gender identity recognised in countries where the practices were not as safe as they would be here in the UK. Does the hon. Lady therefore support the aim that the UK must ensure that we can cater for everyone who needs to access these health services?
4,ParlaMint-GB_2016-07-21-commons.u147,SNP,-0.9169921875,2016-07-21,1.0,"T4. A number of organisations have conveyed disappointment at the Government’s response to the findings of the transgender inquiry conducted by the Women and Equalities Committee. Stonewall has questioned the Government’s insistence on further evidence, believing that they have sufficient evidence to take proper action. Does the Minister accept the assessment that this has been a lost opportunity to ensure that all trans and non-binary people are clearly protected in law, and will she commit herself to working with them and others to achieve true equality for all trans people?"
4,ParlaMint-GB_2016-05-19-commons.u282,OTHER,0.58154296875,2016-05-19,0.0,"I beg to move, That, in accordance with Standing Order No. 149A, the following be appointed as lay members of the Committee on Standards: (1) Jane Burgess and Dr Arun Midha, for a period of six years; and (2) Charmaine Burton and Sir Peter Rubin, for a period of four years As Members will recall, we started in 2013 with three lay members on the Committee on Standards, together with 10 elected members. Let me take this opportunity to thank the three pioneers who were appointed at that time—Sharon Darcy, Peter Jinman and Walter Radar—for their continuing dedication to the work of the Committee. Such has been their impact that in March 2015 the House agreed to the Committee’s recommendation that there should be equality of numbers, with seven elected and seven lay members. Last year, the House of Commons Commission accordingly set in train a recruitment process to select four additional members, and today’s motion is the last step in that process The Commission has produced a report giving much more detail of the process that was followed, but, for the record, I should emphasise that, in accordance with the Standing Order, these candidates were selected on the basis of a fair and open competition. The recruitment panel was headed by an independent chair and was assisted by a recruitment consultant Rather pleasingly, 380 applications were received. After longlisting, shortlisting and final interviews, the panel put forward to the Commission a package of candidates reflecting a mix of skills and experience and a diversity of background, gender, age and geographical location. The Commission was happy to endorse those recommendations, and I would like to put on record our thanks to the recruitment panel for its hard work in identifying such a strong group of candidates from the field Looking at the candidates themselves, I am sure the House will agree that they are not just the usual suspects and that they will bring a broad range of insights and experience to their work on the Committee. In brief, Jane Burgess is the partners’ counsellor and a main board director at John Lewis Partnership; Charmaine Burton is involved in community work and is the host of her own radio show in Birmingham; Dr Arun Midha has experience working with a number of public bodies in different sectors, primarily in Wales; and Sir Peter Rubin is the former chair of the General Medical Council and professor emeritus at the University of Nottingham. Further biographical details of all the candidates are published in the Commission’s report for the information of the House and beyond The House will note that the motion proposes differing lengths of office for these appointments. Lay members may be appointed for fixed terms of up to six years. The appointments are not renewable. On the advice of the recruitment panel, the Commission is recommending that the new appointments be staggered to provide for two terms of four years and two of six years, to militate against the loss of expertise and experience when lay members come to the end of their service I am sure other Members will join me in wishing the new lay members well in their new role. I ask the House to agree the motion for the appointments Question put and agreed to."
4,ParlaMint-GB_2021-03-01-commons.u281,OTHER,-0.36181640625,2021-03-01,0.0,"It is a pleasure to follow the hon. Member for East Renfrewshire (Kirsten Oswald). However, I am profoundly disappointed that we have to discuss this amendment to the language in the Bill today against a background of an increasingly bitter and divisive debate about LGBT and transgender rights. I thank the Minister for her reassurance at the beginning of the debate that there is no undermining of LGBT rights and that these issues will be addressed in the future I am sure that I am not alone when I say that it is the proudest boast of my life that I am a mother. I am completely committed to the rights laid down in this Bill. When it was first debated, I was concerned, as were many others, that it had taken too long to bring the legislation before us, and that it did not go far enough in recognising all forms of parenting and the need for wider parental leave. Today, I am more concerned that this important piece of legislation is potentially being, or could be, sidetracked. Regardless of my frustration about the background to the debate, I would not want that delay to happen. I know that there are those in this place who believe that there is an important political point about the language, but I do not believe that it is as important as the necessity for this Bill As a liberal—in this context, I believe that there are many liberals with a small “l” in this place on both sides of the House—I am firmly of the view that language that excludes or remove the rights of any group in favour of another is unacceptable. That is precisely why, for me, gender-neutral language is preferable and why it is used. It does not erase anyone. I certainly do not feel in any way compromised as a woman by its use, or that my rights are in any way undermined. For me, it also reflects more accurately the reality of modern life The Bill relates to benefits accruing to those who give birth, extending them to Government Ministers and some Opposition spokespeople who currently do not have those benefits. It does not deal with the registration of births; it is not proposed that that process be changed. Neither does the scope extend to legal gender recognition or restrictions. In that context, I would have no objection whatever to the gender-neutral language if it were used, and I have no intention of objecting to the change. However, I cannot see why Parliament would not persist with gender-neutral language in the future. As the Minister made it clear that there will be further legislation, that this legislation does not affect LGBT rights, and that, if the occasion arises, a trans male Minister would not be disadvantaged, I feel that the importance of this legislation —and of having it enacted as quickly as possible—means that we should not delay over perfectly legal language."
4,ParlaMint-GB_2020-09-24-commons.u171,OTHER,-0.88671875,2020-09-24,0.9404543838089424,"On 13 July, Baroness Barker’s office submitted a freedom of information request asking for details of who the Secretary of State met with regards to the Gender Recognition Act 2004. To date, there has been no answer. Will she now confirm whether she personally met trans-led organisations and trans people before making this important decision, which ignores the views and recommendations of a clear majority of those who responded to the consultation?"
5,ParlaMint-GB_2022-02-25-commons.u103,CON,0.94921875,2022-02-25,0.24189040174256315,"The Government propose to transform United Kingdom pensions. We are making them safer, better and greener and the Bill is a further way forward. I am grateful to the hon. Member for Rutherglen and Hamilton West (Margaret Ferrier) for introducing the Bill and for the support of the official Opposition and other political parties Let me briefly address the three points raised by the hon. Member for Westminster North (Ms Buck) on behalf of Her Majesty’s Opposition. I assure her that there will be full consultation on the legislation. There will also be broad communication, but I will write to her on that point and place a copy of the letter in the Commons Library and the House of Lords Library so that all peers and Members can see it In respect of gender inequality, the hon. Lady will be aware that successive Governments have concluded that the way ahead on that is automatic enrolment—that is the greatest change. There is no doubt that automatic enrolment has transformed saving in this country. For example, in terms of workplace pensions, women were at less than 40% in 2012 and are now at more than 80%, and young people aged between 22 and 29 were at less than 40% and are now at 80%."
5,ParlaMint-GB_2022-02-25-commons.u99,CON,0.83349609375,2022-02-25,0.19276920589593494,"I congratulate the hon. Member for Rutherglen and Hamilton West (Margaret Ferrier) on successfully bringing forward this well-considered Bill and for so excellently and comprehensively explaining why we need it When the Equal Pay Act gained Royal Assent on 29 May 1970, the House took an all-important step towards ensuring the equal treatment of the sexes in the workplace. It also sent a broader message about the United Kingdom’s societal values. Since the Act’s commencement in 1975, even greater strides have been taken towards ensuring gender equality. However, as I am sure colleagues agree, much work remains to be done to that end As lawmakers, we in this House all have a responsibility to strive continuously towards the goal of gender equality through legislation, whether modest, substantial or otherwise, and the Bill can rightly be seen as a means of doing that. Specifically, it will right a historical oversight by making crucial clarifications in relation to guaranteed minimum pensions equalisation and pension schemes Madam Deputy Speaker, you can see that I am holding a wonderful speech that I have criss-crossed out because I do not think I need to go through all of that detail—we also have other people who wish to speak and other Bills to consider. However, proposals and methodology brought in during 2016 and 2017 should be secured in relevant regulations, including the positive impact that they would have on the equality of outcome for the sexes. These concerns must be properly addressed in legislation, and that is what the Bill rightly seeks to do. It has also been welcomed by leaders across industry as covering key areas where clarification is most needed, which will make the important process of equalising benefits using GMP conversion easier Bearing that positive reception from industry in mind, and given the broader message that it sends about the importance of the equality of the sexes in legislative matters both significant and modest, I strongly welcome the Bill and offer it my wholehearted support."
5,ParlaMint-GB_2015-12-09-commons.u398,CON,0.8173828125,2015-12-09,0.24602912288707224,"I could not agree more. The work that the Government have done on flexible parental leave will be of enormous value to many families not only in my constituency, but around the country If there is one thing by which we measure society, it is surely how it treats those who have contributed all their lives—those who have worked hard and paid into the system. That includes those who, as has been said, have spent many years raising children. We recognise that contribution in society, and it is right that we should do the same through the state pension system. It is fair that the years that parents—again, disproportionately mothers—spend outside the full-time workforce raising children will go towards their pension pot. Sixty-one per cent. of our women will see their pension rise as a result of this reform. That is equality in action Women in Dudley South and throughout the country will certainly be better off as the economy continues to grow, as wages continue to rise, and as more and more people continue to find work. It does not matter where they are on their journey in life—this Government are working hard to transform our country so that whether people are starting their first job, bringing up their first child or enjoying their retirement, there is no longer any disparity between the genders. Sadly, it is not a transformation that will happen overnight. It is not a simple task, but it is a vital moral mission, and one that I am proud to support."
5,ParlaMint-GB_2016-01-07-commons.u258,CON,-0.74755859375,2016-01-07,0.1862351513254491,"My hon. Friend is absolutely right. That is why fairness needs to be applied to everybody, and in this case, there is a cohort of women who are simply not being treated fairly. Our state pension system is funded on the contributory principle. This is not a state benefit for which no prior commitment is involved, yet this group of women who have been paying national insurance contributions over many years in good faith and who have fulfilled their end of the deal face being short-changed retrospectively We need to bear in mind many other factors. Fewer than one in four women who qualify for the new state pension in 2016-17 will get the full amount. Right up to 2054, fewer women than men will qualify for the full standard pension. Women are significantly more likely than men to work part time, and to do so for longer periods throughout their working lives, largely driven by caring roles, as hon. Members have mentioned. They therefore tend to be under-pensioned I welcome the fact that the new single-tier pension will recognise periods of time spent caring, which will help in the future, and I acknowledge that the Government have made progress on shrinking the gender pay gap—an issue on which consultation is in place. Progress has been made, with more women in work than ever before. We have seen lots of generous reforms—on entitlement to free child care, the national living wage and so forth—but all those are far too late for a generation of women who relied on work without many of the benefits that we now take for granted, while bringing up their families and discharging their caring responsibilities. Because of the number of women who are going out to work, many others have caring responsibilities for grandchildren as well as having to hold down part-time jobs."
5,ParlaMint-GB_2016-01-07-commons.u262,CON,-0.79638671875,2016-01-07,1.0,"I will not give way Those women had precious little time in which to make alternative arrangements, even if they could afford to. That could not happen now because of changes introduced in the state pension review of 2015. However, Angela Heasman, one of my Shoreham constituents, pointed out: “A very important point that I feel has been missed here is that if one considers what if ten or 15 years notice bad been given? For the women, like myself, who are low earners in part-time work, they would not have had enough or any disposable income to pay into a private pension on top of the high and ever rising contributions to National Insurance To put this in perspective, in order to save enough into a private pension for an annuity of £6,000 pa you are looking at…£100,000. This is why for low paid people their National Insurance contributions are all they can afford and consequently totally dependent upon a state pension. Therefore even ten years notice is not enough time for the low paid to pay into a private pension that would equal the State Pension.” She suggested that “the reintroduction of Pension Credit, which is means tested, would alleviate, at a stroke, those who find themselves in this invidious position. If Pension Credit could be reinstated from 60, and add on Pensioner Benefits this would lift those who are genuinely hit the hardest out of extreme poverty.” I ask the Minister to consider that suggestion It is difficult for many older women to stay in the workplace or get back into it. Unemployment rates among women over 50 are well above the national average. The gender pay gap is at its worst for women in their 50s—exactly the sort of women whom we are discussing Recent comments from Steve Webb, the former Pensions Minister, strongly indicate that he acknowledged that the Department for Work and Pensions had been at fault in failing to provide adequate notice for the women affected when he made a big fuss about negotiating a six-month concession at the time. That has been compounded by his recent comment that the Government had “made a bad decision” about the state pension age, and had been badly briefed During previous debates, when the last changes were made, the Minister gave strong indications that transitional arrangements would be made for the worst affected, but that has not happened. Why not? Will the Minister please revisit that undertaking As I said earlier, I have received many e-mails from around the country and from my own constituents. Let me end my speech by quoting the closing paragraph of a letter from a woman in Worthing. She wrote: “I have also heard some MPs say that older people should downsize their homes to free up the housing stock for families. We did this so that our larger house, where my husband had lived all his life, could be enjoyed by a family but we are quickly using up any money for normal day to day expenses…It seems that we older women who have contributed to society are considered unimportant and not worth the financial support that we have earned over the years.” I believe that we risk breaching the trust of women who have made many sacrifices, and who do not now have the expectations for their retirement that they were led to believe they would have."
5,ParlaMint-GB_2016-11-30-commons.u444,CON,-0.82275390625,2016-11-30,0.0,"I am sorry; I am not taking interventions I draw hon. Members’ attention to the fact that the Institute of Chartered Accountants of Scotland has called into question the reliability of the figures that the SNP has been trying to sell to us. So let us look at this problem. We are living longer. If I start work at 16 and get a pension at 66, I will be receiving that pension for a third of my life. A third of babies born this year will live to 100. We are not a party that kicks the can of difficult decisions down the road. Can we create a policy without a cliff edge? No. My sister and I will go through a difficult period between 2026 and 2028, because she is 18 months older than me and will retire a full year earlier. Like my hon. Friend the Member for Weaver Vale (Graham Evans), I have seen the pension age go up. We have had to make adaptations and it is tough Should we not be looking at this differently? The motion tells us that all women want this solution. That is not the case. I have had women write to me to say that they felt they had been informed. I would not want us to go backwards in this regard. I believe, as many hon. Members do, in the equalisation of the pension age. That is right and proper. Moreover, we should be fighting to remove the gender pay gap, which is not due to be equalised for 43 years. That is a much bigger problem. There are some exceptions, as my hon. Friend the Member for Bromley and Chislehurst (Robert Neill) said. A constituent of mine volunteered overseas and lost her professional registration. She now has a low-paid job, but she plans and she saves. I am grateful that the Minister is looking into these cases I will not support the motion. It ignores our children. Our generation has done better than they have done. They have tuition fees, soaring rents and difficulties with housing. I oppose the motion because it is financially unsustainable."
5,ParlaMint-GB_2019-01-31-commons.u501,LAB,0.8994140625,2019-01-31,0.5145687515243772,"I thank the Minister for giving way. I recognise the point he is making with regard to the equalisation of pensions between genders and increasing life expectancy, and we are all grateful to be living longer. But does he recognise that these mainly working-class women did manual and physically oppressive work, often starting at the age of 15, and they are not sharing in the benefits of longer life expectancy because of health inequalities? Does he recognise that inherent unfairness?"
