topic,speech_id,party,speaker_party,sentiment,speech_date,prob,speech
4,ParlaMint-UA_2015-01-14-m0.u12,фОПЗЖ.фОпоблок.фПР,фОпоблок,-1.0,2015-01-14,0.10792040824890137,"Уважаемый Владимир Борисович, уважаемые коллеги, уважаемый народ Украины! Бюджетный кодекс, продавленный 28 декабря правительством, прямо направленный на уменьшение прав местных бюджетов. И в результате ударит по нашим гражданам. Вместо обещанной децентрализации на самом деле мы получили закручивание гаек. Местные общины попросту ломают через колено, сбрасывают на них непрофинансированные расходы, отбирают полномочия и стабильные источники доходов. В результате очень скоро мы увидим жесточайший бюджетный дисбаланс и невозможность финансирования важнейших отраслей бюджетной сферы. Это не фискальная децентрализация, это фикция. У местных бюджетов отобрали 25 процентов налога на доходы физических лиц, который является основным стабильным источником их наполнения. Что же мы имеем? Предложили взамен компенсацию части налога на прибыль и введение новых платежей, размер которых на сегодняшний момент спрогнозировать вообще достаточно сложно. Но заложенные правительством 30 миллиардов дополнительных доходов – это виртуальные средства, которые должны получить бюджеты областные. И при этом не факт, что местные бюджеты получат эти средства, на территориях которых находятся эти предприятия. В итоге доля собственных доходов на местах не превысят 22 процентов. Это показатель прошлого года. То же касается у нас и децентрализации средств и экологического налога, который тоже передан из государственного бюджета областным бюджетам. И опять та же ситуация, при которой не известно, получат ли местные бюджеты свои средства, которые будут направлены на улучшение экологической ситуации на местах. Следующий момент критический и важный для каждого украинца. Это содержание медицины и образования. Правительство ввело новые виды субвенции на эти цели. И должно было полностью покрыть эти расходы. Но объем средств, которые придут на места, покрывают только три четвертых их потребности. Только в моем родном городе сумма фактическая. недостаточная субвенция на медицину и образование составляет 240 миллионов гривен. О чем это говорится? О том, чтобы покрыть эту недостачу, поддержать медицину, городскому бюджету придется урезать расходы на ЖКХ, транспорт и строительство. Более того, 900 объектов по всей Украине на сегодняшний момент – под угрозой закрытия. Ответственность за их финансирование полностью передана местным бюджетам. Это библиотеки, детские садики и поликлиники. И за каждым из этих объектов, брошенных на произвол судьбы, стоят жизни и благополучие наших людей, наших граждан, которые работают или получают услуги. Это антисоциальные и антирегиональные инициативы. А Закон о бюджете 2015 года должен быть изменен на принципах восстановления экономики и повышения уровня."
4,ParlaMint-UA_2021-10-19-m0.u14,фОПЗЖ.фОпоблок.фПР,фОПЗЖ,-1.0,2021-10-19,0.00929824449121952,"Шановний головуючий, шановні колеги, шановні виборці! Стрімке падіння доходів і рівня життя, рекордна захворюваність і смертність на COVID-19, чергове здорожчання вартості комунальних послуг, тотальне зубожіння, рекордні борги по зарплатам, платіжки та інше. Провал євроінтеграції на фоні скасування фактичного мораторію на експорт лісу-кругляку, зовнішньополітична і зовнішньоекономічна ізоляція країни, скандали з відмивання коштів та офшори у Washington Post, Guardian та Forbes – це все Україна Зеленського. Країна, яка фактично не придатна для проживання, країна, яка скоріше нагадує помийну яму корумповану, сировинну, економічно відсталу. Подивіться структуру економіки з абсолютно бідним населенням, і країну без майбутнього. Ось яку країну будує Зеленський, не сприймає нашої критики і альтернативного курсу країни. Він не визначає ні фіскальну, ні бюджетну, ні митну, ні іншу економічну політику, яка фактично сьогодні має бути фундаментом відродження національної економіки. На сьогоднішній день замість того, щоб займатися економічними і соціальними питаннями, Президент Зеленський займається виключно незаконними та антиконституційними речами. Той, хто має бути гарантом Конституції, діє всупереч Конституції і порушує її, запроваджує незаконні, неконституційні санкції щодо членів нашої партії, щодо Віктора Медведчука та членів його сім'ї. Замість того, щоб вирішувати питання нагальні, які турбують людей, тарифної політики, питання зайнятості, стимулювання реального сектору економіки, ми маємо лише незаконні сфальсифіковані кримінальні переслідування. Між іншим, вчора в інтерв'ю, чи позавчора, в інтерв'ю Володимир Зеленський нарешті зізнався, для чого взагалі ці всі сфабриковані і сфальсифіковані кримінальні переслідування й інсинуації щодо Віктора Медведчука. Виявляється, він хоче таким чином натиснути на Володимира Путіна – абсурд, який робиться ще й з українських телеканалів, по відношенню якого ми бачили позицію навіть Медведєва. Тому з цієї точки зору, на наш погляд, якщо Президент хоче відстоювати якісь двосторонні економічні чи інші відносини зі східним сусідом, нехай сідає за стіл перемовин, а не займається незаконними, неконституційними санкціями щодо нашого лідера і голови політради партії ""Опозиційна платформа – За життя"". На завершення я хочу звернути увагу, що на сьогоднішній день, ви вже говорили за порядок денний, ми потребуємо зовсім інших кроків. Перше – прийняття наших законопроектів щодо зниження тарифів. Прийняття наших законопроектів щодо внесення змін до бюджету, щодо підняття мінімальної заробітної плати, прожиткового мінімуму. Це реальні кроки для подолання бідності і для проходження опалювального сезону. Дякую за увагу."
4,ParlaMint-UA_2021-12-02-m0.u120,OTHER,фСН,0.85888671875,2021-12-02,0.0487605519592762,"Микола Задорожній, фракція ""Слуга народу"", 162 виборчий округ, Сумщина. Шановні колеги, я вважаю, що даний проект Закону про Державний бюджет на 2022 рік варто підтримати. В ньому є суттєві і позитивні зміни, про які вже неодноразово говорили. Говорили про суттєве підвищення зарплат лікарям, які на Сумщині, які по всій Україні постійно, щоденно, 24/7 борються за життя наших співгромадян. Крім того, я дякую уряду і особисто Прем'єр-міністру Шмигалю Денису Анатолійовичу за те, що минулого року під час поїздки Сумщиною він прийняв і взяв в роботу моє звернення щодо відновлення програми ""Питна вода України"". На сьогоднішній день, особливо сільські території 162 округу всієї Сумщини, я думаю, і багатьох регіонів України, потребують будівництва нового або реконструкції існуючих водогонів. Крім того, у більшості міст зношені як водопровідні і каналізаційні мережі, так і колектори каналізаційні, і очисні споруди. Тому те, що в цьому бюджеті виділено перший мільярд на ці потреби, я вважаю вкрай корисними речами. Багато хто критикує нас, нашу команду і особисто Президента Зеленського стосовно великих інвестицій в інфраструктуру. І я певен, що більшість жителів 162 округу, з ким я постійно комунікую, вдячні за ті нові дороги, за ті нові дитячі садки, школи, стадіони, які покращують інфраструктуру громад. Тому продовження цієї програми і в деякій мірі збільшення фінансування на ці потреби, вони дадуть гарний поштовх не тільки розвитку громад, а і всій економіці країни. Тому я хотів би всіх колег закликати підтримати даний проект закону. А тим, хто нас постійно критикує, звинувачує в брехні, я хочу сказати, що ви і є найбільшими брехунами за останні десять років існування нашої країни. Дякую всім за увагу. Підтримаємо проект бюджету на 2022 рік."
4,ParlaMint-UA_2020-03-04-m1.u65,OTHER,гДовіра,0.7177734375,2020-03-04,0.007812499534338713,"Шановний пане Президент, шановний Голово, народе України і депутати! Група ""Довіра"" перша висловила недовіру діям уряду ще в грудні минулого року. І ми дякуємо Президенту України за відповідальне рішення щодо відставки уряду. Тому що не помиляється тільки той, хто нічого не робить. Ми, група ""Довіра"", підтримуємо Дениса Шмигаля на посаду Прем'єр-міністра України як людину, як професіонала, яка послідовно пройшла всі рівні держслужби і працювала в бізнесі. Ми готові разом з вами розробляти і напрацьовувати стратегії розвитку та, найголовніше, впроваджувати їх зокрема в галузях агровиробництва. І відійти від тонн на долари на душу населення в децентралізації. І відійти від створення громад проїдання бюджету до фінансово спроможних громад. В медичній реформі зробити розумний баланс між державною субвенцією і послугою. Зробити з вами програму разом індустріалізації України. Ми вважаємо, що головним зараз є те, що Президент і кандидат в Прем'єри говорили про людину, про українця. І ми вважаємо, що всі економічні показники, які тут так гарно озвучуються, повинні рахуватися на душу населення. Ми повинні зараз взяти ватерлінію і подивитися, яка середня зарплати українця, яка пенсія сьогодні середня в Україні. І кожен квартал брати той самий показник і дивитися, чи в нас росте заробітна плата в Україні, чи ні, чи ми маємо можливість збільшити пенсію, чи ні, чи в нас є ріст споживчого кошика в Україні, чи його немає. Завдання наше є. всіх нас разом є служити народу України. І тільки народ України повинен відчувати це не великими гаслами, не великими словами, а конкретними діями в кожній українській родині. Я бажаю вам успіху. Я впевнений в тому, що ви справитеся. І нехай Бог хранить Україну. Слава Україні!"
4,ParlaMint-UA_2022-09-20-m0.u17,OTHER,гДовіра,0.6328125,2022-09-20,0.006314123515039682,"Шановний пане Голово, дорогі українці! Класична осіння сесія припадає на бюджетний процес у Верховній Раді. Цього року ми маємо подвійну відповідальність. Потрібно закласти розуміння, як житиме держава і наші люди в наступному році та водночас яким шляхом ми будемо йти до нашої перемоги та омріяного миру. Зрозуміло, що це є складний кошторис воюючої країни. Основний пріоритет – армія, наша безпека та буквально наша боротьба за право існувати. Також ми мусимо зберегти наші соціальні видатки та захистити українців. Переконаний, що маємо більше вкладати в розбудову власного оборонно-промислового комплексу. У запропонованому бюджеті 42 відсотки коштів на Міноборони є видатками розвитку. Ми щиро вдячні нашим партнерам у світі за допомогу, але власний ОПК – це довгострокова стратегія і гарантія нашої національної безпеки. Особливої уваги потребують громади, де не буде центрального опалення, і ми мусимо їх підтримати. Уряд виділив 1,4 мільярда гривень на матеріальний резерв. Ці кошти вже мають перетворитися у генератори, пальне, тверде паливо і все те, що допоможе нашим людям пережити зиму. Вкрай важливо сьогодні максимально швидко реагувати на важливі потреби і з медичним устаткуванням. Для прикладу, є серйозне питання у Краматорську в Краматорській лікарні номер 3. Комп'ютерний томограф перевантажений, оскільки діагностує стан здоров'я пацієнтів зі всього регіону, а значна частина яких, хто проходить обстеження, – це наші захисники і вони потребують невідкладного лікування. Із проблемою я офіційно звернувся до міністра охорони здоров'я Віктора Кириловича Ляшка. Виходячи з відповіді, позитивне вирішення може затягнутися у часі у зв'язку з бюрократичними процедурами. Закликаю уряд оперативно відреагувати на це питання. Панове, наша боротьба за збереження незалежності є невпинною, і ми маємо бути готовими до всього. Ми є свідками того, як ворог посилює атаки на нашу енергетику. Мета зрозуміла: помста за успіх українського контрнаступу на Харківщині, деморалізація українського суспільства та ядерний терор усього світу. Але в них нічого не вийде. Дякую за увагу. Слава Україні!"
4,ParlaMint-UA_2020-05-19-m0.u2,OTHER,фВОБ,-1.0,2020-05-19,0.004166852682828903,"Шановні колеги, я хочу привернути вашу увагу, що організація ЮНІСЕФ, яка входить структурним підрозділом в Організацію Об'єднаних Націй, зробила публічне повідомлення про те, що в Україні різко збільшився рівень бідності з 27 відсотків майже до 50, особливо дитяча бідність. Це виходить за всі межі норм і правил. Крім того, ви добре знаєте, що більшість медиків, які працювали з COVID, не отримали 300-відсоткову надбавку. Ви прекрасно знаєте, що пенсіонери, яким обіцяли по тисячі гривень, не отримали цю доплату тисячу гривень, не проведена індексація осучаснення пенсій. І ще у малозабезпечених родин, ми ледве не проголосували закон, щоб забрати правило, що їм не можна платити менше ніж мінімальний прожитковий рівень, його частину. Але все це пов'язано з тим, що в державі немає грошей. Вже багато місяців підряд ми недоотримаємо доходи від 25 до 35 відсотків доходів щомісяця. Бюджет валиться. І вже ті 120 мільярдів, які зробили секвестр бюджету, вже, на жаль, не вистачає. Мінімум дефіцит по року недовиконання доходів по податках, по митниці буде десь 300 мільярдів. Це мінімум. Це означає, що розвалені всі фінанси країни. Але в той же час наша команда тимчасової слідчої комісії, яку ми з вами створили разом, про дослідження корупції при неоплаті податків розслідувала деякі цифри НАК ""Нафтогазу"". Я хочу зараз, щоб мене почув кожен в цьому залі. 72 мільярди гривень не доплачено НАК ""Нафтогазом"" в бюджет, і ці гроші частково є на їх рахунку. Одна наша дія – і ми можемо рівно стільки, скільки нам обіцяє Міжнародний валютний фонд, отримати від НАК ""Нафтогазу"". Але для цього треба, щоб 8 депутатів від ""Слуги народу"" в тимчасовій слідчій комісії проголосували за розслідування корупції НАК ""Нафтогазу"". У ваших руках все. Я зараз звертаюся до фракції ""Слуга народу"". Дайте директиву вашим депутатам, які входять в тимчасову слідчу комісію, не саботувати, не блокувати питання розслідування корупції НАК ""Нафтогазу"", а проголосувати за це і перерахувати в бюджет 72 мільярди, заплатити лікарям, пенсіонерам, дітям, аграріям, всім, кому можливо. У ваших руках це. Одна дія – 72 мільярди в бюджет, і не треба ніякого МВФ. Зробіть це, і ви підтвердите, що епоха корупції завершена."
