topic,speech_id,party,speaker_party,sentiment,speech_date,prob,speech
7,ParlaMint-UA_2018-03-21-m0.u69,OTHER,фВОБ,-1.0,2018-03-21,0.012282145209610462,"Шановні колеги! Чому наша фракція наполягала на повній процедурі обговорення? Тому що, на жаль, ви бачите, ні представники уряду, ні порядку регулювання цього питання законодавством, до цього часу, за всі ці 17 років, які пробують ратифікувати цю конвенцію, так і не встановлено. В чому тут ключові моменти? На жаль, питання усиновлення стало дуже серйозним тіньовим, брудним і огидним бізнесом. У свій час існувало обмеження, коли дітей можна було всиновлювати лише з серйозними вадами здоров'я, був перелік навіть захворювань, з якими можна було тільки віддавати дітей і всиновлювати іноземцями. Але і тут шахраї, які знаходилися у відповідних відомствах, знаходили лазейки, коли дітей, хворих СНІДом, не було хворих СНІДом, а їх вносили в базу даних тільки для того, щоб заплатили в тіньову касу всиновлення цих дітей. Такі випадки є серед українців, які проживають в Польщі, в Чехії, в багатьох інших країнах, які хотіли, вони є громадянами цих країн, які хотіли всиновити важко хворих дітей, але їм виставляли такі суми, що вони навіть не хотіли потім підходити до органів влади. І саме тому ключове питання цієї конвенції, це найважливіше, да, нам треба зробити все можливе, щоб жодна дитина в нашій країні, так само як це є в Сполучених Штатах або в будь-якій іншій країні, і дня фактично не перебувала в Будинку малютки чи, тим більш, в будинку для тих, хто не має батьків. Ви подивіться, в ключових розвинутих країнах черга яка є, це вже черга, коли десятки, а може і сотні людей, чекають випадок, якщо від дитини відмовилися батьки або якийсь трагічний випадок стався в родині. У нас інша ситуація, у нас ці діти живуть, можливо, в найкращих умовах, але без батьківської опіки. Саме тому наша фракція наполягає на тому, щоб ключове питання, яка подальша доля цієї дитини? Бо просто віддати дитину навіть в найбагатшу родину або в найбагатшу країну - це не є вирішення питання. Найважливіше, щоб дитина була реально далі під постійним наглядом і контролем посольств, представництв, де списки цих дітей повинні бути постійним питанням послів або уповноважених осіб в посольствах, де вони повинні виїжджали в ці родини, відслідковувати, яка доля подальша цих дітей. От саме тому і відбувається такий важкий процес ратифікації цієї конвенції. Тому, мені здається, ми робимо неправильно. Давайте спочатку врегулюємо це нашим законодавством, щоб перекрити всі лазейки, всі можливості, які не дають можливості контролю. І тільки ті країни, які погоджуються на такий контроль, мають бути право допущено до усиновлення наших дітей. І я вважаю, що все-таки це право."
7,ParlaMint-UA_2019-07-11-m1.u2,OTHER,фЛяшко,-1.0,2019-07-11,0.04957752674818039,"Шановні українці, шановні колеги, і сьогодні є унікальний шанс нарешті прийняти закони, які зупинять епідемію сексуальних злочинів проти українських дітей. За перше півріччя цього року в Україні майже 200 діточок стали жертвами сексуального насильства педофілів. Згадайте трагедію на Одещині, коли була вбита одинадцятирічна дівчинка Дар'я Лук'яненко. Згадайте трагедію, як 5 липня у Дніпрі був затриманий черговий покидьок, який убив дівчину 2005 року народження, зґвалтував і вбив. Кожного дня страждає дитина. За минулу добу четверо дітей стали жертвами педофілів. Ми пропонуємо прийняти наш закон. Дякую комітету, який його підтримав за основу і в цілому. Запровадити найжорсткішу відповідальність за сексуальних маніяків. Мінімум 15 років тюрми без права дострокового звільнення. Пожиттєвий нагляд правоохоронних органів за цими злочинцями. Відкритий, наголошую, відкритий реєстр педофілів. Щоб не тільки правоохоронні органи, а кожна мама, кожен батько міг зайти і подивитись, де може чатувати загроза, де може бути цей покидьок. Щоб він на пушечний вистріл не підходив ні до школи, ні до дитсадка, ні до дитячого майданчика. Хімічна примусова кастрація педофілів, щоб він не міг ґвалтувати дітей. Якщо ми з вами приймемо ці закони, світовий досвід показує, епідемія сексуального насильства проти дітей буде зупинена. Давайте це зробимо. Я звертаюсь до Голови парламенту. Заради пам'яті Дар'ї Лук'яненко, Тетяни Мізіної, Насті Балябіної, Аліни Васютіної і сотень інших українських дітей, які вже були вбиті, давайте приймемо цей закон. Я прошу парламент проголосувати за Закон 6449 і назвати цей закон іменем одинадцятирічної."
8,ParlaMint-UA_2015-04-09-m1.u91,фБПП.фЄС.фУДАР,фБПП,0.465576171875,2015-04-09,0.05265376716852188,"Я замість голови підкомітету, він просто з поважної причини відсутній. Комітет Верховної Ради з питань правової політики та правосуддя розглянув на своєму засіданні 11 лютого 2015 року проект Закону про внесення змін до деяких законодавчих актів щодо умов повернення строкових депозитів (за номером 1195) від 2 грудня 2014 року, поданий народними депутатами Різаненком та Бєльковою. Згідно з Пояснювальною запискою до законопроекту, мета є встановлення стабільної банківської системи через врегулювання механізму створення ресурсної бази діяльності банківської системи. Для досягнення цієї мети авторами пропонується внести зміни до статей 1060 і 1065 Цивільного кодексу та статті 13 Закону ""Про цінні папери і фондовий ринок"", відповідно до яких клієнти банку матимуть право отримати вклади та нараховані по ним відсотки за строковим банківським договором по закінченню терміну дії договору, на відміну від чинного в даний час правила, за яким, зокрема, фізичні особи-вкладники можуть отримати власний вклад або його частину на першу вимогу. Дострокове повернення даного вкладу та нарахування процентів за цим вкладом можливо виключно у випадку, коли це передбачено умовами договору банківського строкового вкладу. Національний банк України підтримує прийняття законопроекту. Комітет Верховної Ради з питань фінансової політики та банківської діяльності також підтримує його прийняття. Відповідно до висновку Головного науково-експертного управління вказаний законопроект за результатами розгляду його в першому читанні доцільно повернути суб'єкту права законодавчої ініціативи на доопрацювання. Комітет, розглянувши відповідні всі матеріали, вирішив рекомендувати Верховній Раді України проект Закону про внесення змін до деяких законодавчих актів за номером 1195, поданий народними депутатами Бєльковою та Різаненком, прийняти за основу. Причому під час обговорення народні депутати члени комітету зауважили на необхідності передбачати можливість для вкладників вимагати дострокового повернення вкладених коштів до спливу строку банківського строкового вкладу у виключних випадках тяжкої хвороби, смерті одного з членів сім'ї, настання обставин, що поставили власну сім'ю в скрутне матеріальне становище тощо. Члени комітету вважають за доцільне встановити, що в разі звернення вкладника з вимогою про видачу вкладу до настання терміну, зумовленого договором банківського строку вкладу банк здійснює."
8,ParlaMint-UA_2021-07-01-m1.u135,фБПП.фЄС.фУДАР,фЄС,0.264892578125,2021-07-01,0.011490603908896446,"Шановні колеги, шановні українці, в умовах необхідності підтримки бізнесу в Україні в карантинний та посткарантинний період, в умовах падіння економіки в Україні уряд пропонує посилити податковий тиск на бізнес та ще й прикривається нібито руйнуванням схем. Необхідність підготовки та подання цього альтернативного законопроекту народними депутатами фракції ""Європейська солідарність"" пояснюється необхідністю забезпечення стабільності та стимулювання економічного зростання в Україні без збільшення податкового навантаження. Тому законопроектом пропонується з 1 січня 2022 року запровадити податок на виведений капітал на заміну податку на прибуток, з 2 січня 22-го року запровадити 3-річний мораторій на збільшення ставок податків і зборів, на заміну бази та/або об'єктів оподаткування, що призводить до збільшення суми податку та/або збору. Установити, що строк дії мораторію на проведення документальних та фактичних перевірок платників податків не може скорочуватися Кабінетом Міністрів у період карантину, встановити без виключень заборону на проведення органами державного нагляду планових заходів і здійснення державного нагляду і так далі. Існують інші норми, які ми запропонували, які позитивно вплинуть на діяльність бізнесу і життя людей в Україні. За оцінками провідних світових та українських економістів у другій половині 21-го року та у 22-му році тенденції розвитку економічних відносин у світі матимуть найбільш сприятливі умови для проведення стимулюючих для розвитку економіки реформ і цим скористаються всі країни, крім України. Отже, без збільшення тягаря на бізнес, альтернативним, економічно обґрунтованим підходом зможемо в цілому забезпечити оздоровлення та посилення конкурентоспроможності економіки України, а також убезпечить від корупційних ризиків, що позитивно вплине на умови ведення бізнесу. Дуже прошу підтримати альтернативний і зовсім інший за філософією проект закону. Ми за бізнес. За розвиток економіки в Україні."
8,ParlaMint-UA_2021-12-02-m0.u295,фБПП.фЄС.фУДАР,фЄС,-0.464599609375,2021-12-02,0.03245037421584129,"Дякую. Шановні колеги, дивіться я би хотів сказати, що до 69 правки включно вся мова йде про перехідні гроші. І тому я б хотів звернути вашу, що від пояснень комітету насправді має дуже серйозно залежати це підтримувати чи ні. Я впевнений, що колеги, особливо колеги, які не представляють монобільшість, вносять законопроекти, де вказують правильні напрямки використання цих коштів. Але ж, коли немає матеріалів, коли немає пояснень, а в той час у вас недофінансована армія, у вас недофінансовані лікарі, якщо у вас недофінансовані вчителі, якщо у нас недофінансована програма замовлення озброєнь, як можна от так голосувати за витрачання коштів, вибачте, на незрозумілі авіакомпанії України, на знову-таки ""велике крадівництво"" на дорогах і на забаганки людей в округах, які витрачаються часто-густо не туди, куди планувалося. Особливо з урахуванням поправок 82 і 83, про які я ще."
8,ParlaMint-UA_2018-04-17-m0.u96,фБПП.фЄС.фУДАР,фБПП,-0.951171875,2018-04-17,0.005742114037275314,"Ми обговорювали ризики і на засіданні комітету, і коли ми проводили робочі круглі столи. Я не бачу жодних проблем, пов'язаних з будь-якими ризиками, про які ви говорите. Але я приведу приклад, що. Дивіться, за діючими нормами закону у вихідні дні ми не можемо, ніхто не має права прийти і перевіряти підприємство. В тому числі сьогодні у вихідні дні жодна інституція, інспекція не може прийти перевіряти ядерні блоки на атомних наших станціях. Сьогодні ми не можемо одночасно зайти для перевірки на 15, на 3, на 4 атомних блоки. Це не є дискусія, що хтось хоче зробити гірше, це є дискусія в тому, що краще нам питання, пов'язані з безпекою, для профілактики, для унеможливлення таких ситуацій, які у нас були багато років тому, тому що ви самі бачите, які процеси відбуваються в країні. Тому питання безпеки атомних блоків повинно бути ""питання номер один"". Я не бачу ризиків тих питаннях, про які ви сьогодні говорите."
8,ParlaMint-UA_2020-11-17-m0.u191,фБПП.фЄС.фУДАР,фЄС,-0.99658203125,2020-11-17,0.04750289022922516,"Шановні колеги, просто не допрацювали цей проект закону. Ми ж абсолютно чітко усвідомлюємо, що ця оборудка пройде, але для того, щоб гроші були для ковідного фонду і для виплати шахтарям, невраховані поправки дають можливість зараз, те, що говорить пан Олександр, якимось чином добирати з інших джерел гроші для того, щоб закривати всю цю операцію, яка планується. Тому я думаю, що всі категорично проти цього, але зараз змовчуєте. Навіщо ви даєте таку можливість зараз перетворити хорошу операцію з хорошими намірами на операцію, яка буде не здійснена в прозорий спосіб, будуть підганятися різні суми і використовуватися різні схеми. Ще раз повторюю, НАК не заплатить податок на прибуток ні за 2020 рік, ні за 2021 рік. Ви прийняли тільки що, проголосувавши червоними за попередню поправку. Прошу поставити 97 поправку, бо тут якраз стосується сплати податку на прибуток ""Укрнафтою""."
8,ParlaMint-UA_2021-11-17-m0.u126,фБПП.фЄС.фУДАР,фЄС,-1.0,2021-11-17,0.9627805948257446,"Дякую. Колеги, вчора ви дуже правильно провалили цей законопроект, тому що це чергова афера. В ситуації, коли сьогодні збільшуються тарифи, збільшується вартість проїзду громадян, чергова афера – це, як знаєте, телеканал ""Дім"", на який сьогодні йде фінансів більше, ніж на суспільне мовлення, а лобісти в цьому залі, ми знаємо їх прізвища, намагаються створити так званого якогось там національного перевізника. І під це будуть не тільки корупційні схеми створені, а й ми знаємо, звідки будуть поставлятися і які літаки. І повірте, ця інформація вас шокує. Тому ми дуже закликаємо вас не брати зараз участі в аферах абсолютно лобістських, які не прикрашають партію влади, яка би мала зараз займатися підняттям зарплат лікарям, знайти гроші на обіцяну ""Вовину тисячу"", на які немає грошей, насправді, в бюджеті, і дозволити витрачати цю ""Вовину тисячу"" на ліки і на тести, а не на ""квартальні"" там квитки і на спортзали. І не беріть участі."
8,ParlaMint-UA_2020-06-30-m0.u101,фОПЗЖ.фОпоблок.фПР,фОПЗЖ,-0.283447265625,2020-06-30,0.03044813685119152,"Шановні колеги, 1874 – спеціальні обов'язки організатора азартних ігор у гральних закладах казино. Колеги, ну, які це спеціальні обов'язки? Ну, неможна сьогодні повертати в країну азартні ігри. Ми з вами сьогодні. У нас залишилось майже два тижні до кінця цієї сесії. І ми сьогодні з вами мали б можливість розглянути законопроекти, якими підтримали б людей: внесення змін до бюджету, захист наших лікарів, перегляд пенсій, перегляд прожиткового мінімуму, захист родин з дітьми. Хоч вы и ненавидите дітей в Україні, но сьогодні у нас був би шанс реально підтримати ці родини. Повернути виплати людям, підтримати в період карантину та коронавірусу. А ви замість цього пропонуєте повернути казино, щоб діти туди бігли, до тих казино в поисках щасливої долі? Тому ми вимагаємо поставити на підтвердження цю правку."
8,ParlaMint-UA_2020-07-02-m0.u212,фОПЗЖ.фОпоблок.фПР,фОПЗЖ,-0.505859375,2020-07-02,0.015506088733673096,"Дякую, Дмитро Олександрович. Перш за все, хочу висловити свою позицію та позицію своєї фракції: цей законопроект приймати не можна, його потрібно відхилити, тому що він дуже небезпечний як для громадян, як для сімей, як для дітей, котрі вже мають цю хворобу – або лудоманію, або ігроманію. І я вважаю за потрібне ще раз запросити депутатів монобільшості прислухатися до всіх виступаючих сьогодні. І я розумію, що цей законопроект не буде відхилений. Але є поправки, які треба прийняти і хоч щось зробити для того, щоб він був менш небезпечний. Перша правка – це чотири і п'ять зірок замість трьох."
