topic,speech_id,party,speaker_party,sentiment,speech_date,prob,speech
2,ParlaMint-UA_2017-05-26-m0.u67,фОПЗЖ.фОпоблок.фПР,фОпоблок,0.6201171875,2017-05-26,0.005038144066929817,"Шановні виборці! Шановні колеги! У найближчу середу 31 травня Україна разом з усім світом відзначатиме Всесвітній день без тютюну. Для мене ця тема є радісною та, водночас, і болючою. Я щиро радий та пишаюся українським парламентом, який у 2012 році за активної роботи багатьох депутатів та громадських активістів вніс зміни в антитютюнове законодавство: повністю була заборонена реклама тютюну, а кафе, бари та ресторани звільнилися від їдкого диму сигарет. Ці та інші заходи допомогли перенести Україну з ганебного четвертого місця за поширеністю куріння у третій десяток. Ми загальмували тютюнову епідемію та стали одними із світових лідерів у сфері захисту людей від сигарет. Найбільш вражаючим результатом для мене стало те, що поширеність щоденного куріння серед молоді віком з 18 до 30 років знизилась з 37 відсотків – у 2013 році до 26,7 – у 2017 році. Нація стає здоровішою. У той же час мені прикро, що з 2012 року вже пройшло 5 років і жодних інших нецінових заходів по зменшенню вживання тютюну не відбулося. Так, ми маємо гарну динаміку збільшення акцизів на тютюнові вироби, і як наслідок збільшення ціни на сигарети, але жодних антитютюнових заходів і законів поки що не вдалося прийняти. За ці п'ять років тютюнова індустрія смерті сконцентрувалася на наших дітях та молоді, адже саме залучення нових курців є їхнім фінансовим майбутнім. Мною та іншими 18 депутатами з усіх фракцій парламенту зареєстрований закон, проект Закону 4030, який також підтриманий профільним Комітетом охорони здоров'я та передбачає серед усього заборону та. заборону на викладку сигарет, яка сьогодні використовується як реклама в обхід на заборони. Та і він є під загрозою після того, як Комітет з питань податкової та митної політики зареєстрував так званий доопрацьований законопроект 2430-д і переконує, що він включає ініціативи всіх антитютюнових законопроектів включно із тими, які пропонувалися в нашому законопроекті. Хочу заявити, що це є відверте введення в оману колег наших депутатів. Дуже сподіваюся, шановні колеги, що ті добрі напрацювання, які вже має Україна в боротьбі з тютюнопалінням, ми зможемо разом з вами продовжити. А громадян закликаю долучитися до громадської підтримки тих законодавчих ініціатив, які дозволяють звільнити наших дітей і нашу країну від тютюнопаління, а як наслідок завдання."
2,ParlaMint-UA_2020-11-03-m0.u16,фОПЗЖ.фОпоблок.фПР,фОПЗЖ,0.3203125,2020-11-03,0.9440851211547852,"Народний депутат Скорик, фракція ""Опозиційної платформи – За життя"". Шановні колеги, шановна президія, шановні громадяни України! Перш за все, дозвольте мені від імені нашої політичної сили подякувати всім українським громадянам, які на останніх місцевих виборах віддали свій голос за нашу політичну силу. І від імені нашої політичної сили можу запевнити, що наші представники на місцях зроблять все для того, щоб виправдати вашу довіру. Ви знаєте, у мене таке відчуття, що у нас суспільство живе в одному світі, а влада в паралельному. Замість того, щоб перейматися чесним підрахунком голосів і підведенням офіційних підсумків місцевих виборів, замість того, щоб робити реальні кроки щодо поновлення миру в нашій державі, замість того, щоб перейматися питанням зниження тарифів, а у нас тарифи на сьогоднішній день набагато вищі ніж були при попередній владі, а діюча влада запевняла нас, що буде навпаки, замість того, щоб реально боротися з COVID, а я можу доповісти, що сьогодні ми встановили черговий рекорд – 8 тисяч 899 захворювань за добу, це рекорд і це говорить про те, що ми скачуємося в прірву серйознішої епідемії, абсолютно не готові для цього. Замість того, щоб дійсно працювати над підготовкою нормального бюджету, а не грабіжницького, який пропонується нашій державі, сьогодні, на жаль, президентська команда, його більшість в Верховній Раді штовхає країну до дійсно конституційного перевороту і конституційної кризи. Те, що зараз відбувається, я можу сказати, що як громадянин, як член фракції партія ""Опозиційна платформа – За життя"", як народний депутат має всі ознаки узурпації влади. Той законопроект щодо розгону Конституційного Суду, фактичного розгону Конституційного Суду є абсолютно неконституційним. Ви нехтуєте точкою зору Венеційської комісії, ви нехтуєте точкою зору українського суспільства, і те, що зараз відбувається, це фактично повторення подій 2014 року. Я вважаю і закликаю вас, колеги, перейматися проблемами країни. На сьогоднішній день головні проблеми знаходяться саме в площині об'єднання нас навколо ключових проблем, які я щойно перерахував: це мир, це тарифи, це боротьба з COVID, це підняття економіки. Це турбує не тільки мою рідну Одесу, це турбує всі міста нашої країни від сходу на захід і від півночі на південь. Ми маємо об'єднатися навколо нормальних питань, а не навколо конституційного заколоту. Якщо, не дай Боже, ви проголосуєте за ці законопроекти, ви будете відповідати за законом. Мені б дуже цього не хотілося. Мені б хотілося, щоб ми разом з вами працювали задля української держави, задля наших."
2,ParlaMint-UA_2020-03-04-m1.u77,фОПЗЖ.фОпоблок.фПР,фОПЗЖ,-1.0,2020-03-04,0.01890905573964119,"Шановний пане Президенте! Шановна президія! Дорогі наші співвітчизники! Отже, сьогодні ми підбиваємо підсумки першого експерименту вашої монобільшості над українським народом. Підсумок сумний. Тут немає жодної політики, тут є порожні кармани людей, падіння виробництва, розвал економіки, добивання медицини та багато іншого, що наші громадяни відчувають на собі. Та і ви теж. Отже, перший млинець вийшов великим комом. Але підсумки цього експерименту я б хотів трошки підвести. Падіння промисловості – 5 відсотків, якась загадкова діра у Пенсійному фонді, вантажопотік – втрата 30 відсотків на рік, борги по зарплаті – більше 3 мільярди, закриття лікарень, шкіл, тотальний розпродаж перлин вітчизняної промисловості – портів, а тепер вже і шкіл. Це сумний підсумок реальної економічної катастрофи. Але тепер поговоримо про майбутнє. Отже, експеримент номер два – Прем'єр-міністр Шмигаль. На жаль, кандидат у Прем'єр-міністри не зустрічався з нашою фракцією. Через це виходжу з короткої зустрічі, декілька хвилин, яка була у мене особисто з кандидатом. По-перше, я запитав у нього, чи будуть відбудовуватися нормальні економічні стосунки зі всіма нашими сусідами, що є запорукою економічного зростання. Я отримав відповідь: торгувати з Росією як страною-агресором ми не плануємо. По-друге. Друге питання, яке я задав майбутньому прем'єру, яким курсом ми підемо. Я отримав відповідь, що ми будемо розвивати цінності Майдану. Які цінності, я не знаю, він не сказав. Виходячи з викладеного, хочу вам сказати, у мене склалося впечатление, что мы меняем шило на мило. Ми не будемо підтримувати новий уряд, потому что ніяких ідей про те, як наповнити бюджет, зробити наших людей багатішими, вивести країну з кризи, я не побачив. Дуже шкода, що замість створення уряду національного порятунку, замість консультацій з усіма фракціями нашого парламенту монобільшість знову самотужки приймає ключові рішення для нашої країни. І наостанок. Ми не радіємо вашим провалам, тому що це провали нашої України. Тому ми сподіваємося, ми всі хочемо бачити країну сильною та квітучою. Тому, коли ви зрозумієте, що економіка має бути відділена від політики, коли ви переконаєтесь, що лозунгом народ не нагодуєш, ми готові підказати, підтримати і підставити плече на благо нашої з вами держави України. Ми знаходимося в опозиції вашому уряду, але не в опозиції Україні. Ми не будемо ніколи в опозиції Україні, тому що інтереси держави ми ставимо вище вузько політичних інтересів хай навіть своєї партії. Ми підтримали відставку уряду Гончарука, оскільки цей уряд був катастрофою. Тепер звертаюся до вас, монобільшість. Певний проміжок часу."
2,ParlaMint-UA_2015-04-10-m0.u128,фОПЗЖ.фОпоблок.фПР,фОпоблок,-1.0,2015-04-10,0.9592155814170837,"Константин Павлов, 31 мажоритарный округ. город Кривой Рог. Уважаемый народ Украины, уважаемые коллеги! Вы избраны народом, но создается такое ощущение, что вы не хотите замечать тех реалий, в которых сегодня оказались простые украинцы, что вы не ездите в свои избирательные округа или, приезжая туда, сидите за высоким забором. Иначе сложно объяснить позицию и не включения в повестку дня законопроектов, внесенных ""Оппозиционным блоком"". Я встречался с сотнями людей у себя в Кривом Роге. Как вы знаете, не самый бедный город в Украине, средняя зарплата в котором на 25 процентов выше, чем в среднем по стране. Но и в нем люди уже не только не знают, как нормально жить дальше, но и как вообще выжить. В первую очередь мы должны защитить тех, кто вообще-то, напомню вам, отстоял, а потом отстроил нашу страну, – это ветеранов. Мы требуем вернуть ветеранам Великой Отечественной войны все полагающие льготы, введенные по инициативе правительства ограничения, нарушают Конституцию Украины и игнорируют многочисленные решение Конституционного Суда, запрещающие сужать социальные права и гарантии ветеранов. Плюс к этому – критическая ситуация с медикаментами. Правительство зарубило успешный проект по снижению стоимости лекарств от гипертонии, и этот проект давал возможность улучшить здоровье для 12 миллионов больных гипертонией, а это 9 из 10 ветеранов. В январе 2015 года по сравнению с январем 2014 года потребление лекарств в натуральном выражение снизилось на 20 процентов, что у нас вдруг все перестали болеть? Нет. Люди просто не могут купить себе лекарства, а значит обречены на медленную смерть. И это в XXI веке накануне празднования семидесятилетия великой победы в Великой Отечественной войне. Второе. Мы требуем незамедлительно принять законопроект об установлении придельных торговых надбавок на отдельные группы товаров. По сути дела это мера, чтобы сдержать рост цен на продукты, медикаменты и другое. Простой пример: цены на отечественные овощи и фрукты выросли за год на 30-50 процентов, а импортные на 100-150; молочные продукты на 30-40 процентов; крупы, сахар на 20 до 100. Обращаю ваше внимание, уважаемые коллеги, что реализация законопроекта не требует дополнительных затрат бюджета, предлагается ограничить торговую наценку в размере 15 процентов на товары, от которых зависит жизнь и быт людей, основные продукты, все виды топлива в том числе для обогрева жилья, детские питания и медикаменты. Мы также требуем запретить повышение тарифов на коммуналку и вернуть прежние тарифы по состоянию на 1 января 2014 года. Также просто необходимо поднять уровень прожиточного минимума до фактически размера прожиточного минимума с учетом цен на январь 2015 года. Мы требуем отменить бесчеловечный 15-процентный налог на пенсии ветеранов, чернобыльцев, инвалидов, шахтеров и горняков, и химиков. Законопроекты из социального пакета должны быть рассмотрены и приняты это вопрос элементарного выживания миллионов людей. И, поверьте, если вы сегодня не захотите прислушаться к нашим предложениям, то завтра вы услышите сотни людей у себя дома, а затем голос миллионов украинцев, которые мы сегодня пытаемся донести до вас под Верховной Радой. Спасибо за внимание."
2,ParlaMint-UA_2019-07-09-m0.u2,фОПЗЖ.фОпоблок.фПР,фОпоблок,-1.0,2019-07-09,0.019041864201426506,"Шановний народе України, на цьому тижні закінчує свою роботу найгірша, на думку людей, Верховна Рада. Давайте чесно підведемо підсумки її 5 років. Провладні партії під гаслами про європейські цінності насправді вели нас до націоналістичної диктатури, перетворюючи в країну з бідними людьми і епідеміями хвороб, яких до цього не було багато десятиліть. Хотіли розпродати землю. Розколювали питаннями мови, віри та історії. Заробляли на війні. Вони хотіли, щоб українці боялися майбутнього і ненавиділи один одного. 21 липня ми повинні проголосувати розумом, а не емоціями, ми повинні осмислити, чому були ці 5 років обману, і зрозуміти, що треба робити. Перше. У новий парламент повинні прийти ті, у кого вже є успішний досвід управління підприємствами та містами, у кого вже є чітка програма для виведення країни з кризи. Нагадую, у нинішній Раді 56 відсотків нових облич, принаймні так здавалося 5 років тому. У новий парламент теж ідуть багато представників шоу-бізнесу і спортсменів. Але в України немає часу, щоб вони ставили чергові експерименти над народом між концертами і корпоративами. Новому Президенту вдасться підняти країну тільки, якщо в Раді буде конструктивна робота. І ми готові допомагати. Друге. Необхідно відновити справедливість по відношенню до людей. У центрі державної політики повинна бути людина, українець, а не власні інтереси українських нардепів та політиків. Україна опустилась на останнє місце в Європі за рівнем зарплат і пенсій, при цьому коаліція проголосувала за збільшення окладів депутатам у три рази. Новий парламент і проголосований ним Кабмін повинні знизити тарифи, стабілізувати ціни і забезпечити реальне зростання зарплат і пенсій людям, а не лише собі. Для цього - третє – забезпечити зростання економіки. І це теж можуть зробити тільки ті, хто розбирається в промисловості, хто вже створював робочі місця з гідною заробітною платою. І головне – треба припинити війну. Під всі ці завдання у нас є розроблені законопроекти. ""Опозиційний блок"" подав 1 тисячу 321 законопроект, з яких тільки 52 прийнято. Провладним ""партіям війни"" не були потрібні наші конкретні рішення, спрямовані на відновлення миру, розвиток підприємств та гідне життя людей, на об'єднання країни. Але вони потрібні народу України. І ми це зробимо в новому парламенті. Просьба добавить."
