topic,speech_id,party,sentiment,speech_date,prob,speech
2,ParlaMint-SI_2006-02-01-SDZ4-Redna-13.u134,SD,0.591796875,2006-02-01,0.6136080026626587,"Hvala predsedujoči še enkrat za besedo. Socialni demokrati predlog zakona o spremembah in dopolnitvah zakona o varstvu okolja podpiramo, saj se zavedamo, da gre za prenos ene pomembnih direktiv. Ta direktiva na evropski ravni prinaša enega od ekonomskih instrumentov obvladovanja podnebnih sprememb, ki jih je mednarodna skupnost sprejela z uveljavitvijo okvirne Konvencije Organizacije Združenih narodov o podnebnih spremembah in na njegovi podlagi sprejetega Kjotskega protokola. Torej, gre za zelo zahteven proces, ki pa po svoji vsebino očitno vključuje tudi trgovanje s pravicami do emisij toplogrednih plinov. O tem predlogu bo država določila v državnem načrtu razdelitev emisijskih kuponov, del izvajanja direktive pa bo vlada prihranila za sebe, če lahko temu tako rečemo in bo izvrševala določitev kriterijev za odobritev skupnih projektov in skupnih naložb pač v skladu s kriteriji, ki jih bo določila s svojimi internimi akti oziroma akti, ki so v njeni pristojnost, tako da upamo, da bo tudi ta rešitev, ki ne bo deležna razprav v državnem zboru, ustrezna za dosego ciljev, ki so v tej direktivi seveda zapisane. Drugo poglavje oziroma druga tema, ki je obravnavana v tem predlogu zakona o varstvu okolja, se nanaša na celovito presojo vplivov na okolje. Gre predvsem za celovito presojo vplivov na okolje v postopku priprave plana, programa načrta ali drugega splošnega akta in njegovih sprememb. Celovita presoja vplivov se izvede za plan, ki ga na podlagi zakona sprejme pristojni organ države ali občine, tako za področje urejanja prostora, upravljanja voda, gospodarjenja z gozdovi, ribištva, rudarstva, energetike, industrije prometa, ravnanje z odpadki. Gre pa v Sloveniji tudi za območja, ki imajo že zakonsko predpisano, da v vsakem primeru morajo izdelati celovito presojo vplivov na okolje, to pa so tista območja, ki so vključena v Naturo 2000. Torej, nekje od 35% površine Slovenije je vključeno v Naturo 2000 in za tiste občine, ki imajo to območje, je ta presoja vpliva na okolje nujna. Dosedanje zakonske rešitve niso občinam zagotavljale dodatnih sredstev za celovito presojo vplivov na okolje, čeprav je država to nalogo na teh območjih Nature 2000 naložila občinam, da jo morajo izdelati. Rešitve, ki so v tem zakonu bile prvotno predvidene, so bile usmerjene v to smer, da se del teh stroškov sicer prizna, in sicer gre po prvotnem predlogu predlagatelja za stroške revizije takšne celovite presoje vplivov na okolje. Na odboru smo vendarle dosegli spremembo, tako da se s strani državnega proračuna financira tudi okoljsko poročilo, ki je podlaga za izdelavo celovite presoje vplivov za okolje, vendar še vedno v naši poslanski skupini menimo, da ta ukrep ni zadosten in da, če je država nekaj naložila lokalnim skupnostim preko Nature 2000, potem seveda je potrebno te stroške v celoti tudi prevzeti. Zato smo tudi vložili še dodaten amandma, ki govori o tem, da država prevzame tudi stroške celovite presoje vplive na okolje na območjih Nature 2000. Sicer pa pozdravljamo rešitev, da so občine po tem zakonu upravičene do dela plačila koncesije, ki pripada državi za izkoriščanje naravnih bogastev. Problem pri tem vidimo samo v tem, ker ni določenih kriterijev, v kakšni višini naj bi ta del plačila pripadal občini in ker je Natura 2000 zagotovo ena od tistih območjih, ki je eno najzahtevnejših, predlagamo v našem amandmaju, da tem občinam pripada najmanj 70% tega plačila. Kajti v smernicah pri Naturi 2000 zasledimo zelo hude omejitve, ki govorijo o tem, da se gradnja prometnic omejuje, da se nizki preleti plovil izvršujejo izven ekološkega območja, da krčitev gozdov ni dopustna, da gozdnih površin ni mogoče koristiti v času, bom rekel, gnezdenja ptic in podobno. Skratka, zelo veliki stroški nastajajo in želimo, da se ti tudi upravičeno namenjajo v ta območja v večji višini."
2,ParlaMint-SI_2008-06-27-SDZ4-Redna-40.u20,SD,-0.9423828125,2008-06-27,0.5016530752182007,"Hvala za besedo in lep pozdrav tudi v imenu Poslanske skupine Socialnih demokratov. Za razliko od drugih poslanskih skupin Socialni demokrati ugotavljamo, da je zakon o spremembah in dopolnitvah Zakona o varstvu okolja odraz slabega dela Ministrstva za okolje in Vlade na področju varovanja okolja. To se odraža skozi dejstva, da zamujamo pri uvedbi direktive zaradi odgovornosti v zvezi s preprečevanjem in sanacijo okoljske škode, zato nam s strani Evropske komisije grozi tožba. Tudi neustrezno upoštevanje odločbe Ustavnega sodišča je rešitev na katero želimo posebej opozoriti, kajti gre za neustrezno urejanje sodelovanja javnosti na področju varstva okolja. Vendar, Vlada se želi očitno tudi temu sodelovanju z neustrezno rešitvijo še naprej izogibati. Tudi nedoseganje Kjotskega protokola pomeni, da moramo v proračunu Republike Slovenije zagotoviti 20 milijonov evrov za nakup emisijskih kuponov, s čimer si pravzaprav kupujemo dovoljenje za nadaljnje onesnaževanje. To so nekateri najosnovnejši in najpomembnejši poudarki zakona o katerem govorimo. Še posebej pa bi rad še enkrat izpostavil vprašanje odločbe Ustavnega sodišča in po našem mnenju tako s strani pravno-tehničnega vidika neprimerno rešitev, ki si jo je izbrala Vlada za upoštevanje odločbe Ustavnega sodišča. Namreč, Ustavno sodišče je ugotovilo, da je v nasprotju z Ustavo Zakon o ohranjanju narave. Mi pa danes spreminjamo Zakon o varstvu okolja, ki naj bi bil krovni zakon na tem področju in potem naj bi za vse skupaj veljalo, tudi za vse ostale zakone, tako za Zakon o ohranjanju narave tako za Zakon o vodah, gozdovih in tako naprej, žal temu ni tako, naš pravni red pozna drugačne rešitve in želimo na to še posebej opozoriti. Tudi iz odločbe Ustavnega sodišča izhaja, da mora zakonodajalec upoštevajoč določbe 8. člena Aarhuške konvencije v zakonu, s katerim organu izvršilne veje oblasti daje pooblastilo za izdajo podzakonskih aktov, ki urejajo področje varstva okolja, določiti tudi procesna pravila za učinkovito vključitev javnosti v pripravo teh predpisov. Torej gre tudi za mednarodni akt, ki nalaga Sloveniji, da ustrezno vključi javnost v postopek, ko razglašamo posamezna območja za območja v katerih želimo ohranjati biotsko raznovrstnost ali različne živalske vrste. V Sloveniji, naj ponazorim, potekajo ti postopki resnično povsem v nasprotju s tem mednarodnim in našim pravnim redom. Kdo v parlamentu ali katere od občin v Sloveniji so seznanjene, da je Vlada Republike Slovenije povečala območje Nature 2000 iz 33% slovenskega ozemlja na 36%? Prav nihče od javnosti, ki načrtuje posege v prostor, lokalne skupnosti so pa osnovne pri načrtovanju oblikovanja rabe prostora, niso bile vključene v ta postopek in Vlada jih o tem ni obveščala. To kaže na dejstvo kakšen pristop ima Vlada v stiku z in upoštevanju interesa javnosti pri njihovih razvojnih potrebah. Še bolj boleče je to, ker se to dogaja na območjih, ki potrebujejo jutri pomemben dostop oziroma učinkovit dostop do infrastrukture in s tem si lahko ta območja zagotovijo tudi nadaljnji razvoj, vendar Vlada hkrati, ko umešča trase v prostor za izgradnjo cest, na istem območju razglasi potem Naturo 2000, kar pomeni, da zavestno onemogoča razvoj posameznih območij v Republiki Sloveniji. Ob takšnih rešitvah, ki jih tudi Zakon o varstvu okolja ne odpravlja, kajti morali bi se danes pogovarjati o odločbi Ustavnega sodišča o Zakonu o ohranjanju narave. Tako slabo pripravljenega zakona ni mogoče podpreti. Hvala."
2,ParlaMint-SI_2021-07-09-SDZ8-Redna-24.u66,SD,-0.97509765625,2021-07-09,0.22884084284305573,"Hvala lepa, podpredsednik, za besedo. Spoštovane kolegice, spoštovani kolegi! Če smo še pred desetletji razmišljali in pretežno uporabljali zgolj vračljivo embalažo, je to danes povsem nekaj drugega. Takrat, pred desetletji, je v bistvu bilo povsem normalno, da smo šli s steklenico po mleko v trgovino, smo menjali, to danes absolutno ni več tako. Zato se pojavlja na trgu embalaža, ki obremenjuje naše okolje. To me res pošteno skrbi. Zakaj? Še posebej zato, ker v bistvu ta nerazgradljiva embalaža leži vsepovsod v naših gozdovih in tako te, kot je kolegica pred mano povedala, žalosti dejstvo, ko vidiš, kaj se dogaja v naravi, v okolju ob sprehodu, ko ležijo pločevinke po tleh v naravnem okolju, to se nikoli ne bo razgradilo. Nadalje nerazgradljive vrečke, rokavice in še bi lahko naštevali. Dejansko imamo akcijo enkrat na leto, ko se nekako civilna družba in mi vsi skupaj ozavestimo o tem na dan Zemlje in gremo pobirat vso to odpadno embalažo, ki se nabira v našem okolju. Zberejo se kupi in kupi embalaže, ampak to se pobere, potem pa se ponovno začne onesnaževanje in to je spet en začaran krog. In če je še bilo nekako pred leti pričakovati, da se bomo te embalaže nekako rešili ali pa jo nadomestili spet s povratno embalažo, je v času koronakrize to še bolj eskaliralo. Te embalaže je bilo vsepovsod ogromno, kajti ponudniki gostinskih storitev so dajali hrano v to nevračljivo embalažo, ki smo jo potrošniki prevzemali in so ponovno doma nastajali kupi in kupi odpadkov. V blokovskih naseljih so ti rumeni kesoni bruhali te embalaže. Seveda so se trudili tisti, ki za to poskrbijo, da so to odvažali, ampak tudi to se odvaža na neko določeno deponijo in tudi tam se to kar tako ne razgradi. Tako se mi zdi izjemno izjemno pomembno, da naredimo en korak naprej. In ta zakon, katerega sopodpisniki smo, je en korak v pravo smer. Zakaj? Se bom dotaknila tudi tega. V mnenju Vlade lepo piše, da zamujamo z direktivo. Tega smo sicer že navajeni, ampak ta teden poslušamo take izjave s strani predstavnikov Vlade. Dogaja se, da Vlada običajno prinaša prenos direktiv absolutno prepozno, takrat, ko nam že grozijo kazni. Po tem, ko smo že tako daleč, da že grozijo kazni, enostavno niti mi poslanci nismo več toliko pozorni, kajti zavedamo se, da nam grozijo kazni, in v bistvu kaj drugega ne moreš, kot potrditi prenos direktive v zakonodajo, in dogajajo se napake. In ključen zakon, ki smo ga v tem tednu tudi sprejemali, je bil Zakon o revidiranju, ki ga je bilo potrebno popravljati zaradi tega, ker se je takrat, ko se je hitelo, naredila napaka. Zato bi morali v bistvu, če imamo mi tukaj, da bi morali prenesti direktivo 3. 7. 2021, imeti zakon že na mizi oziroma že skoraj sprejetega, in to niso izgovori. Na ministrstvih bo potrebno delati. Zakaj pa govorim o tem? Ker sem konec leta 2018/2019 prinesla na ministrstvo s poslansko kolegico iz desne strani peticijo, ki jo je pripravila civilna iniciativa v Slovenski Bistrici. Ob dnevu Zemlje so se zbrali in širši javnosti predstavili, kaj se dogaja z okoljem. Imajo izjemno lepo naravno okolje, kakor ga imamo vsi v Sloveniji, in pobrali so vso odpadno embalažo, ki se je nabrala, in jo razstavili po Slovenski Bistrici. Takrat moram reči, da so ljudje videli, kaj se dogaja. Bil je izjemno izjemno velik interes za podpis te peticije, da se sprejme zakonodaja, ki bo prepovedala uporabo nerazgradljive embalaže, in takratni minister in takratni državni sekretar sta zagotovila, da se zakonodaja pripravlja. Minilo je leto in pol. Jaz verjamem, da se je vlada spremenila, da je vlada druga, ampak uradniki so še vedno isti, vsaj mislim, da je večina teh, ki se s tem ukvarja, istih. Sprašujem se, zakaj ne gre ta zakonodaja naprej? Je sicer en korak, tudi pri nas v Državnem zboru smo še – koliko? Mislim, da dobro ali pa slabo leto dni nazaj uporabljali plastične kozarčke za pitje vode, danes že imamo papirnate kozarčke za vodo. Zakaj? Zaradi tega, ker so razgradljivi, to se da uporabljati. Gremo korak naprej, naredimo nekaj za našo naravo. Izjemno pomembno je, da jo rešimo. Kajti vse to nekje ostaja, v naravi, v okolju. Kaj se še dogaja, kar je pa najbolj skrb vzbujajoče? Poznam tako okolje. Pripeljejo na deponijo, črno odlagališče, kakor se mu reče, in tja se navozi vsa ta odpadna embalaža, ker pač recikliranja, takšnega in drugačnega, te odpadne embalaže ni, se nasipa, potem pride plast zemlje pa se spet zapisa pa spet plast zemlje. Imamo kupe in kupe, lahko bi vam pokazala slike. To se dogaja v okolju, od koder jaz prihajam. Mene res res žalosti. Plus tega se sprašujem, kje so pristojne institucije, ki bi dejansko ta črna odlagališča zaznavala oziroma jih odkrivala, ker to na dolgo rok absolutno ne bo šlo, saj imamo potem mi v bistvu naravne vire onesnažene, naravni vir vode, to, kar mi pijemo. Govorim pa konkretno o Rušah, če koga mogoče slučajno zanima. Sicer me državni sekretar ne posluša, ampak pustimo. Zato sem tudi želela nekako govoriti o tej temi, ker mi je to izjemno izjemo pomembno. Resnično, če je bilo takrat obljubljeno, da zakonodaja o prepovedi uporabe plastike bo pripravljena, ne vem kje zdaj želi, enostavno ne vem. Glede na to, da pa imamo še direktivo odzadaj, ki pa je bila tudi leta 2019 sprejeta, bi bilo res za pričakovati, da smo en korak naprej. Ne skozi govoriti s strani vladnih predstavnikov v mnenjih Vlade, kako se to ne da, kako ne gre. Res, zakon je nov zakon, lahko ima težave, mogoče bi ga bilo potrebno spremeniti, sploh ni problem. Zakon gre v nadaljnjo obravnavo, se popravijo določene vsebine, če je potrebno se lahko tudi takšen zakon, če pač smatrate, da ga je potrebno nadgraditi, ta sprejme, se potem spremembe tega zakona naredijo, to je vse. Ampak korak naprej smo naredili, nekaj smo naredili za naše lepo okolje. Kajti mi se moramo zavedati, da ne živimo mi samo danes, mi imajo odzadaj zanamce, ki si želijo naravo čisto in da bodo lahko živeli normalno. Končno bi bilo res, da zaščitimo to naše okolje. Hvala lepa."
2,ParlaMint-SI_2021-12-13-SDZ8-Redna-28.u38,SD,-1.0,2021-12-13,0.6362114548683167,"Hvala, predsednik. Spoštovana ministra, smo 13. decembra. Skoraj dva meseca bo že minilo od tedaj, ko je Evropo dobesedno streslo dejstvo, da se bodo cene energentov, s tem pa tudi ostalih dobrin, enormno povišale. 13 december, skoraj dva meseca po tem, ko smo vas opozorili, da energetska revščina trka tudi na naša vrata. Spoštovana ministra, energetska revščina je brez kakršnihkoli ovir že vstopila v slovenske domove. Še več, zdi se, da je vlada s svojo ignoranco vrata energetski revščini še pomagala odpreti na stežaj. Spoštovani gospod Vrtovec, ko je bilo tudi iz vaše strani rečeno, da ni potrebe za nikakršno paniko, da je vse pod kontrolo, je danes stvar precej drugačna. Mnogo naših državljank in državljanov prav v tem trenutku, ko mi razpravljamo v tej dvorani, sedi v svojih hladnih domovih, ker si ne upajo prižgati radiatorja v strahu pred položnicami, ki prihajajo. Komunala v Trbovljah je svoje uporabnike obvestila, da se bo ogrevanje podražilo za 57 %. Takšna obvestila so v preteklih dneh prejeli ljudje v Ljubljani, v Mariboru, na Vrhniki in drugod. Goriva so danes za več kot 40 % dražja kot pred enim letom. Cena elektrike za 30 %, višajo se cene zemeljskega plina, kurilnega olja, ogrevanja. Problem je jasen in že močno seže v denarnico ljudi, starejših, družin. Problem pa niso samo rastoče cene. Problem je, da vlada pri tem nič ne naredi, da bi stiske ljudi omilila. Besede ne pomagajo. Socialni demokrati smo z opozicijo zahtevali dve nujni seji odborov. O problemu smo na dolgo in široko govorili v Državnem zboru. Od Vlade smo slišali le, da trg deluje in da bo trg vse uredil. Gospod Vrtovec, to so vaše besede. Trg že deluje, ampak bojim se, da ne dela za ljudi. Socialni demokrati smo vas že najmanj dva meseca opozarjamo, da je treba reagirati hitro in celostno, z vsemi možnimi razpoložljivimi sredstvi, ki so na voljo in ki jih je v svojih priporočilih dala tudi Evropska komisija. Prosim vas, predvsem ministra Vrtovca, da ne hitite pojasnjevati, kako je vlada uvedla regulacijo cen kurilnega olja, ko vemo, da je to le obliž na vse bolj krvavečo rano stisk ljudi. Še vedno ni odgovora na vprašanje, kdaj bo Vlada sprejela konkretne pomoči za blaženje energetske revščine, ki jo čutijo predvsem upokojenci z nizkimi pokojninami, brezposelni in zaposleni z nizkimi dohodki. Naj vas ob tem spomnim, da je na seji Odbora za gospodarstvo državni sekretar Ministrstva za infrastrukturo dejal, da bo Vlada pripravila pomoč, ki pa je ni od nikoder. Socialni demokrati smo zato pripravili Zakon o začasnih ukrepih za preprečevanje energetske revščine, ki predvideva energetski dobropis za najranljivejše v naši družbi. Zakon bomo danes, skupaj z opozicijskimi partnerji vložili v zakonodajno proceduro, če se bo ta ignoranca Vlade nadaljevala. Zato vaju, spoštovana ministrstva, sprašujem, prvič: Kdaj bo pripravljen predlog zakona, ki bi revnim in ogroženim omilil posledice energetske draginje? In drugič, ker gredo rešitve zakona, ki ga bomo Socialni demokrati vložili danes, v smer, ki jo je nakazovala tudi Vlada, to se pravi energetski vavčerji v višini 150 evrov, me zanima: Ali boste predlog zakona, ki bo danes vložen, podprli? Hvala za odgovore."
2,ParlaMint-SI_2006-02-01-SDZ4-Redna-13.u142,OTHER,0.8955078125,2006-02-01,0.991604745388031,"Hvala za besedo, gospod podpredsednik, poslanke in poslanci, gospod minister. V poslanski skupini DeSUS spremembe in dopolnitve zakona o varstvu okolja podpiramo. To pa predvsem zaradi pozitivnega pristopa do omenjene problematike, tako predlagatelja zakona kot matičnega delovnega telesa. Zadovoljni smo, da je bilo veliko dilem in tehtnih vprašaj razrešenih z amandmaji odbora, ki so dobri in kvalitetni ter nakazujejo izboljšanje pristopa do varnega in čistega okolja, ki ga narekuje evropska direktiva. Ureditev kot takšna se kaže predvsem v vzpostavitvah shem in trgovanja s pravicami ob izpuščanju toplogrednih plinov v ozračje, v načinu trgovanja s pravicami ter emisijah toplogrednih plinov v obliki emisijskih kuponov. Vsekakor pa je največji del predloga zakona o spremembah in dopolnitvah zakona o varstvu okolja posvečen predvsem merilom, preverjanju in poročanju o stanju, ki je prisotno na določenem ogroženem področju pričakovanih toplogrednih emisij. Slovenija je v trenutku sprejema te zakonodaje že na dobri poti predvsem pozitivnega pristopa do dela, zaveda se problematike, ki je prisotna. Res je, da do sedaj še nimamo velikih izkušenj in zaradi tega tudi zamujamo pri sprejetju sprememb in dopolnil iz predlaganega zakona. Predlagatelj predvideva, da bi z emisijskimi kuponi oziroma njihovim trgovanjem reševali oziroma vplivali na okoljevarstveno politiko v tej smeri, da bi izboljšali obstoječe stanje na tem področju. S podpisom ratifikacije in Kjotskega protokola lahko vse države podpisnice, med njimi tudi naša država, uredijo vse zahteve v nacionalni zakonodaji. Če je temu tako, potem smo nakazali pravilno in hkrati učinkovito pot, ki bo z nakazanimi rešitvami zmanjšala težave predlagane spremembe zakonodaje. Zakon v temeljnem cilju nakazuje prenos direktive iz leta 2004 in način odprave nekaterih pomanjkljivosti in napak, ki so bile in so še prisotne v naši državi. V naši poslanski skupini smo tudi zadovoljni, da sedaj obravnavani predlog zakona ne predstavlja nobenih dodatnih finančnih obremenitev za proračun in ne presega njegovih obstoječih finančnih načrtov in porabe sredstev, razen revizijo ocen predvidenih okoljskih poročil, ki se pripravljajo v občinskih planih, načrtih in programih, ki so predmet celotne presoje vplivov na okolje. Za takšne zadeve kritja se je obvezalo ministrstvo. Opozarjamo, da se kar prevečkrat posega v lastne prihodke občin. Do sedaj je pripravljen samo operativni program odvajanja in čiščenja komunalnih voda, medtem ko so vsaj po mojem vedenju operativni program vodo oskrbe in operativni program odstranjevanja odpadkov s ciljem zmanjšanja količin odloženih bio razgradljivih odpadkov ter program zbiranja odpadkov šele v izdelavi. V naši poslanski skupini kljub nekaterim pomislekom o doslednosti podpiramo evropski pravni red, saj se v njem kaže način obvladovanja podnebnih sprememb v sladu sprejetega Kjotskega protokola in trgovanja z emisijami toplogrednih plinov. Spoštujemo tudi direktivo in pravni red članic na območju EU, zato tudi v predlagani zakonodaji vidimo pozitiven in neodložljiv trenutek za sprejem le-te. Poslanci DeSUS bomo glasovali ""za""."
2,ParlaMint-SI_2006-02-01-SDZ4-Redna-13.u138,OTHER,0.8271484375,2006-02-01,0.9910610318183899,"Hvala lepa za besedo, gospod podpredsednik. Spoštovani vsi navzoči, gospod minister s sodelavcem, kolegice in kolegi. Okolje je življenjski prostor za vse, ki na območju Republike Slovenije živimo. Pomeni predpogoj za opravljanje dela, ustvarjanje dohodka in za človeka dostojno življenje. Smotrna raba, predvsem pa ohranjanje okolja, mora biti cilj vseh naših politik. Vsak Slovencev in Slovenka je dolžan prispevati k temu cilju. V Sloveniji imamo za enkrat še relativno dobro ohranjeno naravo in čisto okolje, kar je izjemnega pomena za kvaliteto življenja v naši državi, pa tudi zaradi dejstva, da se Slovenija želi še bolj uveljaviti kot turistična dežela. Novela zakona o varstvu okolja je potrebna zlasti zaradi zakonodaje Evropske unije. S sedaj veljavnim zakonom je Slovenija med prvimi državami članic v EU v naš pravni red prenesla zahteve direktive o vzpostavitvi sheme za trgovanje s pravicami za izpuščanje toplogrednih plinov, kasnejši pravni akti v zvezi s to direktivo in spremembe direktive pa nalagajo ponovne spremembe zakona o varstvu okolja. Vendar bi bilo razumevanje sprememb zakona zgolj kot posledica različnih direktiv po mnenju poslanske skupine SLS neustrezno. Radi bi poudarili, da predlagane spremembe prinašajo nekaj pomembnih novosti na področju varstva okolja. Prepričani smo, da bodo tudi te spremembe prispevale k boljšemu nadzoru nad onesnaževanjem okolja. Spremembe, ki se nanašajo na sistem trgovanja z emisijskimi kuponi, in skupne naložbe, ki so opredeljene v Kjotskem protokolu pa prinašajo po eni strani lažje doseganje ciljev Kjotskega protokola, po drugi strani pa lahko s tem dosegamo tudi pozitivne učinke pri uveljavljanju slovenskih podjetij v mednarodnem prostoru. Na vseh področjih je potrebno sprejemati usmeritve, ki so v prid našim, slovenskim podjetjem, še posebej, če se jim s tem olajšuje prodor na mednarodni trg, ki je v globalnem svetu vedno pomembnejši. Ukrepi na področju varstva okolja so seveda v večini primerov podjetjem na nek način v breme, zato moramo toliko bolj poskrbeti za sprejetje tistih ukrepov, ki lahko na področju varstva okolja za slovenska podjetja predstavljajo primerjalno prednost oziroma jih postavljajo vsaj v enakovreden položaj glede na podjetja v drugih državah. Poslanci Slovenske ljudske stranke bomo pripravljeni predlog zakona podprli. Imel bo pozitivne učinke na naše okolje. Hvala."
