topic,speech_id,party,sentiment,speech_date,prob,speech
0,ParlaMint-SI_2013-05-24-SDZ6-Izredna-36.u10,SDS,0.775390625,2013-05-24,0.05954664573073387,"Hvala lepa za besedo. V naši poslanski skupini pozdravljamo včerajšnji dogovor političnih strank. Gre za pomemben dogovor, ki bo vladi Alenke Bratušek omogočil, da bo kot prva vlada dejansko vladala in da bo imela v rokah mnogo močnejše instrumente kot katerakoli vlada pred njo, s tem pa seveda tudi odgovornost. Zavedamo se tudi pomena današnjih odločitev, kajti z uveljavitvijo tako fiskalnega pravila kot referendumske ureditve, se bo mnogo lažje usmerilo državo na zdravo pot razvoja, na pot, ki bo omogočala vladam, da na vzdržen način omogočajo družbeni razvoj, ne pa da bi po nepotrebnem določene stvari bremenile prihodnje rodove in postavljale pod vprašaj zdrave temelje uspešne države, kar je pravzaprav predpogoj, da je država pravna, pravična in do primerne ravni tudi socialna. Slovenska demokratska stranka v času, ko je bila največja vladna stranka, in zdaj, ko je največja opozicijska stranka, ohranja do obeh norm enak odnos, enako pozitiven odnos, in to tako do fiskalnega pravila kot do referendumskih sprememb – podpiramo oboje. Ne predstavljamo si, da bi še naprej izgubljali čas pri izboljšavah ustave in se ob tem zavedali, da v nasprotnem primeru samo izgubljamo kot država, kajti s tem si avtomatično dvigujemo stroške, dodatno pa po nepotrebnem krnimo mednarodni ugled našemu gospodarstvu, našim blagovnim znamkam in pa predvsem tistim gospodarskim družbam, ki se šele prebijajo na zahtevne trge. Že do sedaj smo to odlašanje in izmikanje drago preplačali. Pred nami so do konca naslednjega tedna tri pomembne odločitve. Danes imamo dvotretjinsko odločanje o tej ustavni spremembi, potem v tednu, ki sledi, se moramo na nek način samoomejiti, da ne bomo poslanci, trideset poslancev, vložili zahteve za referendum glede te ustavne spremembe in potem, če bo to izpolnjeno, tudi v soboto najbrž, ko se iztečejo roki, dati glas za sprejem odloka oziroma obeh odlokov. Upam, da bodo včerajšnji dogovori predsednikov strank in vodij poslanskih skupin držali, da bodo držali tudi v tistih strankah, ki so imele do sedaj pomisleke, predvsem pri stranki predsednice Vlade Alenke Bratušek, in od njih pričakujemo, da bodo, tako kot rečemo v žargonu, mož beseda. Predlog za spremembo referendumskih določb, kot sem že dejal, v naši poslanski skupini podpiramo. V pogajanjih za oblikovanje predloženega besedila smo veliko popustili, tudi na osnovi večkratnih razprav na organih stranke. Odločitev za ta kompromis ni bila lahka, vendar smo mnenja, da brez teh sprememb nobena vlada nima dovolj dobrih varovalk za načrtovanje in izvajanje predvsem proračunskih in nekaterih drugih politik države. Navsezadnje smo decembra lani videli, kaj se lahko zgodi, če koga v zanosu potegne evforija in občutek, da je vsemogočen. Tedaj so sindikati javnega sektorja ponosno vložili zahtevo za referendum na Zakon o izvrševanju proračunov, s katero so vsaj začasno želeli zaustaviti izvrševanje proračunov za letos in za prihodnje leto. S tem bi sprožili postopek začasnega financiranja. Takoj se je pokazalo, da bi bile posledice te nepremišljene poteze sindikatov prehude, predvsem za javni sektor, in da bi te posledice zelo težko prinesli na Janševo vlado, čeprav je niso imeli radi. Zelo težko se je bilo ob tem znebiti občutka, da ni šlo za nagajanje Janševi vladi in da tisto ni bil del scenarija rušenja Janševe vlade, ki se je tedaj sicer klavrno končal. Na srečo se ta blokada ni tako izšla, kot so načrtovali sindikati, posledice so bile minimalne, pa še tiste so letele bolj na tedanjo vlado kot na povzročitelja tega, ki se je potem kar nekako potuhnil. Kot sem že dejal, smo znotraj SDS večkrat opravili obširno razpravo v vseh fazah te referendumske spremembe, tako glede omejitev, ki jih prinaša, kakor tudi glede ugotavljanja izida referenduma. Bilo je veliko argumentiranih pomislekov in tudi veliko slabih občutkov zaradi zlorabe oziroma izigravanja referendumske volje volivcev, predvsem pri implementaciji volilnega sistema v ustavo. Rešitev, ki se je nekoč zapisala v ustavo, je bila namreč povsem v nasprotju z večinsko voljo volivcev, tako da se tedaj v ustavo ni zapisal večinski dvokrožni volilni sistem, zaradi česar zdaj vsak okraj nima svojega poslanca in zaradi česar je z zlato olimpijsko medaljo nagrajen nekdo, ki se je uvrstil na 3., 4., 5. mesto, tisti, ki pa je dejansko zmagal, pa je lahko ostal brez nje. Takrat se je takšna anomalija zgodila. Kar pa zadeva konkretne spremembe 90., 97. in 99. člena Ustave pa naslednje. V prvem odstavku se črta 30 poslancev – moram reči, da to ni bila za našo stranko in poslansko skupino enostavna odločitev, kajti s tem se pravzaprav eliminira možnost parlamentarne manjšine, ki se z rešitvijo ne strinja in nima več možnosti, da bi recimo o določeni rešitvi, ureditvi zakonu, ki se sprejme, zahtevala referendum. Vendar je bil to del kompromisa, na katerega je naša stranka in poslanska skupina pristala. Za nas sicer ni bilo sporno črtanje Državnega sveta, kot tistega, ki lahko zahteva referendum, kajti tako imenovani zgornji dom parlamenta ima v postopku možnost zaustavitve oziroma izglasovanja veta na zakon. Mislimo, da je takšna pravica, ki jo ima, dovolj in ne potrebuje še nadgradnje z referendumom. Kar zadeva drugi odstavek, ki je nekoliko obširnejši, pa imamo nekatere pomisleke, ki se jih v postopku pravzaprav ni dalo popolnoma zbistriti, izčistiti. Gre predvsem za to, da se je v ustavno rešitev ponovno zapisalo človekove pravice in temeljne svoboščine. Prav to poglavje je najobsežnejše poglavje, mislim, da ima preko 40 členov Ustave in ena politična skupina je vztrajala, da se to zapiše v ustavo kot pogoj, da sodeluje pri spremembi te ureditve. Tu smo imeli pomisleke in tudi zdaj mislimo, da gre za podvajanje neke ureditve. Tu bi rad opozoril še na to, da je možna zloraba predlagateljev oziroma zakonodajalca, ki lahko v sklopu sanacije protiustavnosti s področja človekovih pravic ali kakšnih drugih rešitev, zlorabi to z zakonom, kjer bo sanacija te protiustavnosti manjši del predlaganega zakona, večji del pa bodo predstavljale morda tudi rešitve, s katerimi se mnogi ne bi strinjali. Glede na to, da so zdaj to samo državljani, bi v tem postopku s to ureditvijo lahko onemogočili njihovo iniciativo. Mi vemo, da v praksi zakoni niso nikoli čisti, nikoli nimamo samo implementacije evropskih direktiv ali drugih zadev, nikoli nimamo samo odprave protiustavnosti, ampak običajno se s tem, ko se predlaga v postopek nek zakon, urejajo še nekatere druge tekoče zadeve. Moram reči, da smo na Ustavni komisiji glede te ureditve izrazili hude pomisleke, interpretacija ustavnih pravnikov je bila nekoliko drugačna, kajti tam pri presoji naj bi prišlo do tehtanja teh pravic. Kljub vsemu pa mislimo, da v primeru, ko bi se urejalo oziroma z zakoni odpravljalo protiustavnost, bi moral biti ta zakon čist, to se pravi, da bi moral odpraviti samo protiustavnost in ne kakšne druge morebitne sporne zadeve. Moram reči, da take zlorabe te ustavne ureditve, ki je sedaj pred nami, ne bi podprli in upamo, da se bodo tisti, ki bodo predlagali zakone ali pa jih bomo sprejemali ali jih bodo kasneje sprejemali, zavedali teh posledic tega člena oziroma te alineje. O tem, kar zadeva določbo glede drugih obveznih dajatev, smo imeli tudi pomisleke. Tukaj mislim, da najbrž do kakšnih hujših zlorab tega ne bi prišlo, kajti ravno vse se na to obvezno dajatev najbrž ne da obesiti. Mislim, da bo ključen poudarek predvsem na tem, da se tu izvzamejo predvsem davki, carine in tisto, kar zajema Zakon o izvrševanju proračuna. Moram reči, da je bila pri nas tudi velika diskusija glede kvoruma; najprej, ker se nam je takrat ta kompromisni predlog, ta kvorum zapisan v prvotno besedilo, zdel previsok in pa kasneje, ko je Ustavna komisija oblikovala to zavrnitveno določbo, smo imeli pomisleke glede rešitve tega 25 % kvoruma za zavrnitev zakona. Pozdravljam, da je bila potem na Ustavni komisiji sprejeta naša pobuda, da se kvorum zniža na 20 %. Mislim, da to ne bi smela biti pri resnih zahtevah za referendum, previsoka ovira, da tega ne bi dosegli. Na koncu bi še poudaril, da sta tako fiskalno pravilo kot referendumska ureditev neke vrste dvojček, ker se pri fiskalnem pravilu postavi pravilo, v katero smer se morajo gibati načrtovanja v javnih financah, z referendumom pa so določene izjeme, pri katerih javno oziroma splošno odločanje, referendumsko odločanje o določenih zadevah ni možno. Sprejem samo referendumske ureditve bi bil nekorekten, kajti fiskalno pravilo je tisto, ki najprej zaveže vlado, vsakokratno vlado, v katero smer lahko pripravi, načrtuje proračun oziroma javne finance, medtem ko referendum omejuje državljane, da ne bi ravno o čemerkoli odločali na referendumu. In mislim, da je pri obeh rešitvah dosežen primeren kompromis. Naša poslanska skupina bo predlog spremembe ustave podprla. Hvala lepa."
0,ParlaMint-SI_2012-09-28-SDZ6-Redna-06.u37,SDS,0.72900390625,2012-09-28,0.16953063011169434,"Hvala lepa za besedo. Lepo pozdravljam predsednika Državnega zbora in državnega sekretarja na Ministrstvu za finance, tudi ministra. Vem, da se bo vrnil v dvorano. Lepo pozdravljeni poslanci in poslanke! Včerajšnji dan so zaznamovali različni dogodki, ki bodo zelo pomembno vplivali na našo prihodnost in zaupanje v našo pravno državo ter jo obvarovali pred krajo države in pred krajo davkoplačevalskega denarja. Med drugimi dogodki je bila to tudi seja Odbora za finance in monetarno politiko, kjer smo obravnavali zakon, ki je danes na mizi. Gospod Frangež je omenil, da Socialni demokrati že dolgo veste in da že cel mandat opozarjate na problem javnih financ. Tudi opozorili ste, da je več modelov za reševanje in da se je sedanja koalicija odločila za najdražji model za odkup slabih terjatev in da je ta model najbolj zahteven tehnično, postopkovno in da so postopki dolgotrajni in tako naprej. Če bi vi, spoštovani Socialni demokrati, imeli kakšen vsebinsko vrednoten model, bi ga, verjamem, z velikim veseljem na odboru ali v delovni skupini obravnavali in o tem danes tudi razpravljali. S filozofskim razpravljanjem pa si ne moremo nič pomagati. Prejšnja vlada je po mojem mnenju podcenjevala problem javnih financ in problem sistemskih bank, ki so v neposredni in posredni lasti države. Vemo, o katerih bankah govorimo. Soočamo se z negotovostjo v bančnem sektorju. Učinki slabih odločitev predvsem na področju javnih financ prejšnje vlade prihajajo z zamudo, in to vsi danes tudi občutimo. Posledice so krčenje domače gospodarske aktivnosti in velika prizadetost slovenskega gospodarstva v obliki kreditnega krča. Zato je nujno treba ta problem reševati hitro, učinkovito in urgentno. Razlogov, zakaj je treba problem reševati urgentno, je več in so več kot očitni. Bankam so se ob znižanju njihovih bonitet in bonitete dolgoročnega dolga povečali tudi stroški zadolževanja na mednarodnih posojilnih trgih oziroma se jim je dostop do teh virov zelo zelo otežil in omejil. Povprečna kapitalska ustreznost bank je pod povprečjem kapitalske ustreznosti bank držav v Evropski uniji. Po zagotovilu guvernerja Banke Slovenije, ki smo ga dobili včeraj na odboru, naj bi vse naše banke bile solventne, kar je dober podatek, torej tudi v sistemskih bankah. In to daje zaupanje v te naše banke, kar je prav. Vendar pa je solventnost le eden izmed pogojev, ni pa edini, ki bi zadostoval za dvig bonitet bankam ob znižanju stroškov, predvsem stroškov zadolževanja na mednarodnih trgih. Bi pa na tem mestu poudarila svoje mnenje, da je Banka Slovenije kot nadzornik in regulator našega bančnega sistema odreagirala prepočasi in ni ukrepala pravočasno v zvezi z ugotavljanjem kapitalske ustreznosti bank in s postopki za izboljšanje izterjave slabih terjatev, ki temeljijo na kreditih. Zato menim, da je tudi predlog Evropske komisije za ustanovitev evropske bančne unije v redu, ker bo nadzoroval nacionalne centralne banke, realno gledano nekje 160 sistemskih bank, med katerimi bodo tudi naše sistemske banke. Zato je nujno, da preprečimo negativen vpliv slabih terjatev na kapitalski položaj bank, kar pa lahko storimo s postopki, ki so predlagani s to novelo, ki jo imamo na mizi. Predlog zakona predvideva ustanovitev posebne družbe za upravljanje terjatev slabih terjatev bank, ki bo upravljala poseben sklad za upravljanje teh slabih bančnih terjatev. Poglavitni ukrep je prenos teh terjatev z bank na sklad. Ta prenos ne bo avtomatiziran, bo v sodelovanju tudi z Banko Slovenije. Določen je mehanizem prenosa in cena prenosa. Slišali smo po dolgoročni ekonomski vrednosti, ki se bo določala po določenih metodah in po pravilih z določenim pravilnikom. Banke bodo v zameno za slabe terjatve dobile obveznice z državnim poroštvom. Slišali smo, da je zgornja meja tega poroštva države 4 milijarde evrov. Ta javni dolg se bo odplačeval na različne način. Res je, da s tem ne bodo banke kar avtomatsko kapitalsko ustrezne, potrebna bo tudi postopna dokapitalizacija ali iz sklada za odprodajo slabih terjatev ali pa tudi s tujimi vložki. Konkretne ukrepe znotraj posameznih bank, načrt in strategijo bo moral odobriti tudi organ za nadzor konkurenčnosti v Evropski uniji. Namen zakona je ohranitev stabilnosti finančnega sistema v celoti. Cilji so jasni. Cilj ustanovitve te družbe in sklada je izvajanje ukrepov na način, da se zagotovi gospodarna uporaba javnih sredstev in povrnitev proračunskih sredstev, pospeševanje kreditiranja nefinančnega sektorja, privatizacija bank in tudi, kar mislim, da je zelo pomembno poudariti, ugotavljanje odgovornosti za nastanek slabih terjatev bank. Meni osebno se zdi zelo pomembno in ključno to, da se s to novelo takoj prenesejo slabe terjatve na sklad, banke se tako očistijo teh slabih terjatev in lahko takoj sprožijo aktivnosti v smeri reprogramiranja kreditov, s tem bi se tudi dajala pomoč za oživitev podjetij, in to je eden izmed ciljev te vlade. Odprava kreditnega krča in pomagati skozi sistemske rešitve mikro, malim in srednjim podjetjem, samostojnim podjetnikom, možnost za financiranje dejavnosti ter s tem za ponovni zagon gospodarstva in tudi za ohranitev delovnih mest in za nova delovna mesta. To se mi zdi ključno. Zaradi tega podiram predlagani zakon in tudi nujnost sprejetja tega zakona. Hvala lepa."
0,ParlaMint-SI_2014-07-04-SDZ6-Izredna-71.u36,SDS,0.607421875,2014-07-04,0.1488756239414215,"Hvala lepa, spoštovani predsednik. Minister s sodelavko, spoštovani kolegice in kolegi! Danes mineva 14. dan, ko imamo v zaporu prvega političnega zapornika gospoda Janeza Janšo. Zakonske rešitve, ki jih prinaša novela Zakona o izvršbi in zavarovanju, sledijo pomembnemu cilju, in sicer pospešitvi izvršilnih postopkov, izboljšanju ureditve nepremičninske izvršbe za pospešitev postopka ter doseganju boljše realizacije prodanih nepremičnin. Obenem omogoča preglednejše in hitrejše postopke za nepremičnino, ki je obremenjena z zemljiškim dolgom, ob opozorilih, da se je ustanavljanje zemljiškega dolga na nepremičninah zlorabljalo, in poenostavitev ter olajšanje izvršbe preživninskih terjatev. V lanskem letu smo spremenili Stvarnopravni zakonik in ukinili možnost zemljiškega dolga. S predmetno novelo pa se skuša urediti preglednejši in hitrejši postopek izvršbe na nepremičnino, ki je obremenjena z zemljiškim dolgom, torej urejanje zatečenega stanja že izvedenih zemljiških dolgov. Novela poenostavlja in olajšuje ureditev preživninskih terjatev tako, da ima le-ta iz naslova zakonite preživnine absolutno prednost pri poplačilu oziroma izvršbi na denarno terjatev dolžnika. Vsekakor všečne in dobrodošle rešitve, vendar prepozne. Sicer bolje pozno kot nikoli, vendar pri zadevah, kjer gre za vprašanje odločanja v razumnih rokih, pravice do sodnega varstva, ne smemo odlašati in čakati z rešitvami, ki bi odpravile sodne zaostanke. Evropska komisija nas je v pregledu stanja na področju pravosodja Evropske unije opozorila na zaostanke na tem področju. Vprašanje zaostankov na tem področju je izpostavljeno tudi v zavezi za izboljšanje stanja v sodstvu, ki sta jo podpisala Vlada Republike Slovenije in Vrhovno sodiščePovprečna starost izvršilnih zadev je v letu 2012 presegala 20 mesecev. Kje je tukaj upoštevana in zagotovljena pravna varnost? V Poslanski skupini Slovenske demokratske stranke na neučinkovitost sodstva vseskozi opozarjamo. Opozarjamo na vprašanja odgovornosti sodnikov, vendar smo žal preslišani. Žal se za stanje v Sloveniji odgovornost pripisuje le zakonodajalcu, sodstvo pa samo sebi zapoveduje ugled in spoštovanje, kar je seveda zaskrbljujoče. Ugled si sodstvo lahko pridobi le s korektnim in poštenim sojenjem za ceno, kakršno plačujejo drugod, in s sojenjem v razumnih rokih. Velja opozoriti tudi na dejstvo, da Evropsko sodišče za človekove pravice v zadnjih letih spet obsoja Slovenijo zaradi sodnih zaostankov in zaradi nezagotavljanja ustavne in konvencijske pravice do sojenja v razumnem roku. V Poslanski skupini Slovenske demokratske stranke smo za zagotavljanje pravice do sojenja v razumnem roku v povezavi z zagotovitvijo poštenega sojenja v okviru kazenskega postopka predlagali trajanje sodnega postopka največ šest mesecev na prvi stopnji, največ tri mesece na drugi stopnji in največ tri mesece v postopku z izrednimi pravnimi sredstvi na Vrhovnem sodišču. Trajanje sodnega postopka od začetka do pravnomočnosti, vključno z izrednimi pravnimi sredstvi, bi tako lahko trajalo skupaj največ 12 mesecev. Obžalujemo pa dejstvo, da razpadla koalicija omenjene novele ne želi uvrstiti na dnevni red zasedanja Državnega zbora, in to kljub izpolnitvi vseh formalnih pogojev. Ne glede na vse navedeno bomo v Poslanski skupini Slovenske demokratske stranke podprli rešitve, ki jih prinaša novela Zakona o izvršbi in zavarovanju, bomo pa v Slovenski demokratski stranki, tako kot do sedaj, opozarjali na nepravilnosti v sodstvu in pohvalili pozitivne premike. Hvala."
