topic,speech_id,party,sentiment,speech_date,prob,speech
5,ParlaMint-SI_2006-03-30-SDZ4-Redna-15.u8,SD,0.68017578125,2006-03-30,0.08155302703380585,"Predsedujoči, hvala za besedo. Spoštovani državni sekretar s sodelavko, kolegice in kolegi! Poslanska skupina Socialnih demokratov podpira sprejem predloga zakona, ki pomeni logično posledico vstopa Slovenije v Evropsko unijo in odločitve za prevzem evra kot valute Republike Slovenije. Z novelo zakona Slovenija usklajuje delovanje Banke Slovenije s sistemom evropskih centralnih bank in tako poleg makroekonomskih kriterijev izpolnjuje tudi pomemben formalnopravni pogoj za pridobitev pozitivnih mnenj v konvergenčnih poročilih evropske komisije in Evropske centralne banke, ki jih pričakujemo 16. maja. Novela je pripravljena po naši oceni v skladu s pravnim redom Evropske unije in v skladu s statutom evropskega sistema centralnih bank ter Evropske centralne banke. Pri tem se zavedamo, da se vloga Banke Slovenije pomembno spreminja. Prenehajo veljati določbe o denarni politiki in politiki deviznega tečaja, ker te pristojnosti prevzema Evropska centralna banka. Vendar to ne pomeni, kot mnogi mislijo, da država Slovenija in Banka Slovenija izgubljata vpliv na teh področjih. Banka Slovenije bo enakopravni sestavni del evropskega sistema centralnih bank, guverner Banke Slovenije bo polnopravni član Sveta Evropske centralne banke in bo aktivno, tudi s pravico glasovanja, sodeloval pri sprejemanju vseh pomembnih odločitev, tudi s področja prenesenih pristojnosti. Banka Slovenije tako posredno kot neposredno ne bo brez vpliva na vodenje makroekonomskih politik. Centralna banka ohranja vrsto pomembnih dosedanjih nalog, dobiva pa tudi nove. Pomemben se nam zdi tu predvsem nadzor nad bankami, ki ga bo v novih pogojih možno in potrebno še bolj okrepiti, kar bo koristno za zmanjševanje tveganj, kakovost in varnost poslovanja bank, za konkurenčnost in preglednost ter sploh za razvoj finančnega sistema in ne nazadnje za varstvo potrošnikov. Banka Slovenije bo lahko še bolj učinkovito opravljala funkcijo bankirja države za javni sektor. Novela zakona prinaša Banki Slovenije tudi nekatere nove naloge in krepi dosedanje. Pomembno se nam zdi sodelovanje Banke Slovenije s centralnimi bankami drugih držav in mednarodnimi organizacijami. Pomembna bo vloga Banke Slovenije na področju plačilnih sistemov, finančnih operacij in upravljanja premoženja. Banka Slovenije razpolaga s kakovostnim strokovnim kadrom in bogatimi izkušnjami na ekonomsko- in finančno-analitičnem področju, in to bo omogočilo krepitev zelo koristne informacijske analitične in statistične dejavnosti. Ni nepomembno, da se ne le ohranja, temveč celo povečuje neodvisnost centralne banke v povezavi z Evropsko centralno banko in poročanje državnemu zboru dvakrat letno. Hvala za pozornost."
5,ParlaMint-SI_2009-05-22-SDZ5-Izredna-10.u208,SD,-0.90234375,2009-05-22,0.2520424425601959,"Lepo pozdravljeni. Skrajšanje plačilnih rokov je smiselno, vendar ne na račun zmanjšanja davčnega nadzora, ker bi to povzročilo manjše odkrivanje goljufij davčnega vrtiljaka. V primeru skrajšanja roka za vračilo iz 60 oziroma 30 dni na 7 dni, bi se zahtevki praktično potrjevali brez kontrole, saj se s tako radikalnim skrajšanjem roka za vračilo bistveno skrajša čas, namenjen nadzoru obračunov DDV-ja. Glede na dosedanje izkušnje davčne uprave v največ šestih delovnih dneh ni mogoče izvesti nadzora vseh obračunov, ki jih programska podpora izloči oziroma označi za pogojno nepravilne. Zaradi predlaganega ukrepa bi se tudi povzročil velik izpad sredstev za državni proračun, kar pomeni, da bi Vladi zmanjkalo sredstev za zagotavljanje nekaterih pomembnih ukrepov za zmanjšanje učinkov finančne krize. Zaradi tega se strinjamo s tem, da se predlagani zakon zavrne Vlada pa naj prouči skrajšanje plačilnih rokov na način, ki ne bo povzročil zmanjšanja davčnega nadzora in ne bo povzročil večjega izpada sredstev za državni proračun. Skrajšanje roka za vračilo iz 60 oziroma iz 30 na sedem dni bi pomenilo tudi precejšnji likvidnostni izpad javnofinančnih prihodkov v letu 2009. Zlasti v mesecu, ko bi prišlo do spremembe, bi bilo treba zagotoviti sredstva za vračilo DDV mesec prej. Zaradi predlaganih sprememb bi se na podlagi podatkov iz leta 2008 zmanjšali prihodki v proračunu iz naslova DDV za okoli 338 milijonov evrov oziroma 0,8% bruto družbenega proizvoda. To pomeni, da bi zaradi predlaganega ukrepa nekje morali rezati sredstva. Je morebiti predlagatelj razmišljal o tem, kje bi sredstva odvzeli? Verjetno ne, ker bi predlagano znižanje rokov na sedem dni zmanjšalo prihodke iz naslova DDV-ja. Naj pri tem spomnimo, da je Vlada že s spremembami zakona o davčnem postopku zagotovila tekoče zmanjševanje obremenitve pravnih oseb s tem, da se bo pri določitvi višine akontacije davka od dohodkov pravnih oseb za leto 2009 lahko upoštevala stopnja davka, ki bo veljala v letu 2009 in ne stopnja davka iz preteklega leta, kakršna je veljavna ureditev. Na ta način se bo višina plačanih akontacij davka bolj približala višini davka, ki ga bo treba plačati v letu 2010 na podlagi obračunov davka. Predlagani ukrep bo likvidnostno razbremenil gospodarstvo, na podlagi obračunov davkov od dohodkov pravnih oseb se bo gospodarstvo likvidnostno razbremenilo za približno 50 milijonov evrov letno. Ker je treba racionalno uporabiti denar in sredstva ciljno usmeriti v ukrepe za blaženje posledic finančne krize in zaradi tega, ker bi zakon poslabšal nadzor nad davčnimi zavezanci, bo Poslanska skupina Socialnih demokratov podprla sklep, da spremembe zakona o davku na dodano vrednost niso primerne za nadaljnjo obravnavo. V zakonu je tudi predlagana rešitev zvišanja praga obdavčljivega prometa, do katerega sme davčni zavezanec obračunavati in plačevati DDV po plačani realizaciji z 208 tisoč evrov na 7 milijonov 300 tisoč evrov. V letu 2008 bi lahko plačano realizacijo uporabljalo 72.215 zavezancev za DDV, ureditev pa je uporabljalo le 1071 zavezancev, kar predstavlja 1,48% od teoretično upravičenih. Znesek odloženega vstopnega DDV je pri zavezancih, ki uporabljajo posebno ureditev, po plačani realizaciji ob koncu leta 2007 znašal 140.985 evrov, ob koncu leta 2008 pa 135.738 evrov. Glede zvišanja praga za plačano realizacijo DDV naj omenim, da je v predlogu komisije, ki se nanaša na spremembo direktive o DDV v zvezi s pravili za fakturiranje, predvideno odstopanje od splošnih pravil v zvezi z nastankom pravice do odbitka DDV pri uporabi posebne ureditve po plačani realizaciji za vse države članice. Ureditev mora biti na voljo vsem mikro podjetjem, katerih letni promet ne preseže dveh milijonov evrov, kakor je opredeljeno v priporočilu komisije o opredelitvi mikro podjetij, malih in srednje velikih podjetij. Razprava o tem predlogu se je na svetu že pričela. V zvezi s predlaganim pragom 2 milijonov evrov so preliminarna stališča držav članic, da je prag previsok. Po podatkih za leto 2008 lahko ob določenem pragu obdavčljivega prometa v višini 208 tisoč evrov posebno ureditev obračunavanja DDV po plačani realizaciji uporablja približno 73,9 odstotkov vseh zavezancev, registriranih za DDV, ob povišanju praga na 2 milijona evrov pa 93,6 odstotkov zavezancev in ob povišanju praga na 7 milijonov 300 tisoč evrov 96,5 odstotkov vseh zavezancev, kar bi pomenilo znatno odstopanje od splošnega sistema DDV, po katerem se DDV obračunava po fakturirani realizaciji. Zato poslanska skupina Socialnih demokratov tega predloga ne podpira. Glede nižjih stopenj DDV naj omenim, da je prejšnja vlada morebiti zamudila priložnost, da zaprosi za uporabo nižje stopnje DDV, kamor se uvrščajo tudi storitve, v zvezi s katerimi so predlaga nižja stopnja DDV, zatorej bi bilo treba o tem obvestiti komisijo do 31. marca 2006. Slovenija je na podlagi sklepa Vlade z dne 30. 3. 2006 dejansko zahtevala le znižanje DDV v zvezi z uporabo nižje stopnje DDV od storitev obnove in popravil zasebnih stanovanj. Glede na pretečen rok držav članic za odločitev uporabe nižje stopnje DDV, predlog v tem delu torej ni utemeljen. Poleg tega pa so bile na nivoju EU v zvezi z uporabo nižjih stopenj DDV potrjene nekatere spremembe DDV direktive, vključno s črtanjem navedenega 106. člena, na katerega se sklicuje SDS. Poleg tega Poslanska skupina Socialnih demokratov meni, da s predlagano širitvijo obsega nižje stopnje DDV za navedene kategorije ni mogoče doseči večje ekonomske učinkovitosti oziroma namene, ki se jih s predlagano rešitvijo želi doseči in jih predlagatelj zatrjuje v obrazložitvi svojega predloga. Znižanje stopnje DDV namreč ne pomeni tudi nujno znižanja cen blaga oziroma storitev. Glede na to, da je ekonomski učinek uporabe nižje stopnje DDV odvisen od značilnosti posameznega sektorja, bi moralo odločitev o uporabi nižje stopnje DDV spremljati predhodna analiza ekonomskega učinka. Ob tem je tudi treba upoštevati, da zmanjševanje finančnih prihodkov iz naslova DDV vpliva na ne oziroma uravnoteženost posameznih dajatev oziroma na potrebo po povečanju drugih virov prihodkov, namenjenih zagotavljanju potreb proračunskih porabnikov. Prav tako je izkušnja Velike Britanije pri znižanju DDV pokazala, da je predlagani ukrep neučinkovit za doseganje spodbujanja zasebne potrošnje. Zaradi vsega navedenega predlagani zakon ni primeren za nadaljnjo obravnavo. Poslanska skupina Socialnih demokratov bo v skladu s tem tudi glasovala. Hvala."
5,ParlaMint-SI_2009-03-03-SDZ5-Redna-03.u174,SD,-0.970703125,2009-03-03,0.3664998412132263,"Hvala lepa. Predlagana sprememba in dopolnitev Zakona o davku od dohodkov pravnih oseb, v kateri gre za znižanje davčne stopnje od dohodkov, je neučinkovit predlog, ker veliko veliko podjetij v današnjem času, žal, ne bo ustvarjalo dobičkov, ali pa bodo ustvarjali toliko nižje dobičke, da predlagana sprememba ne bo imela takšnega učinka kot bi si želeli. Zatorej, to ni najbolj optimalen ukrep za zmanjševanje učinkov finančne krize. Znižanje davčne stopnje bi predvsem veliko pomenilo nekomu, ki si je ustvaril dobiček s prodajo delnic in bi mu s tem ukrepom država še dodatno pomagala, da pride do še večjega dobička z znižanjem davčnih stopenj. V današnjih razmerah gospodarske krize, kot je bilo že ob predlogu oziroma mnenju in stališčih poslanskih skupin povedano, torej ko gre za razmere na trgu, ki niso najbolj ugodne, torej gre za zmanjševanje obsega proizvodnje, gre za krčenje dejavnosti, gre za manjša naročila od pričakovanih, zato se podjetja oziroma velike gospodarske družbe skoraj in žal ne odločajo za nove investicije. Kljub temu, da bi predlog spremembe povečal likvidnost podjetjem. Analiza učinka zmanjšanja davčne stopnje davka od dohodkov pravnih oseb s pomočjo modela splošnega ravnotežja kaže minimalne učinke na vse elemente BDP. V današnjih razmerah, torej negotovih razmerah, bi bilo in je primernejše, da država direktno spodbuja podjetja, gospodarstvo s subvencijami za investicije v tehnološko opremo in z razpisi za razvojne projekte podjetij. Sprejetje takšnega zakona bi znižalo prihodke državnega proračuna za 350 milijonov evrov, s tem bi primanjkljaj presegel 3% mejo maastrichtskih kriterijev oziroma dosegel, kot je bilo celo tudi povedano 4% primanjkljaj. Posledično bi se zaradi tega poslabšala tudi boniteta Slovenije. Tisti, ki smo morebiti na tem področju že kdaj v življenju delali, vemo, kaj to pomeni. Pomeni, da se poslabša pozicija države, pozicija bank, gospodarstva in prebivalstva pri najemanju kreditov, ker bi vsi našteti imeli oziroma bi težje in tudi pod slabšimi pogoji najemali kredite. Takšna uveljavitev sprememb Zakona o davku od dohodkov pravnih oseb bi na ta način v danem trenutku predvsem zavirala gospodarsko rast, mi pa si v tem momentu želimo predvsem njen pospešitev. Tudi mnenje Evropske komisije o tovrstnih predlaganih spremembah je negativno, torej nam tega v danem trenutku ne priporoča. Verjamem pa, da bo Vlada Republike Slovenije predlagala Državnemu zboru Republike Slovenije sprejem in uvedbo investicijske olajšave tudi za ostala podjetja, ko bo to možno oziroma ko bo situacija to dopuščala ter bomo na ta način normalno spodbujali gospodarsko rast. Danes, kot je bilo tudi že nekajkrat rečeno, so primernejše subvencije za investicije v tehnološko opremo od davčnih olajšav za spodbujanje investicije, ker se s tem dejansko spodbuja investicija. To velja tudi za davčne olajšave za raziskave in razvoj, kjer je bolj primeren ukrep v rebalansu proračuna, ki bo poleg že sedanjih 50-ih milijonov povečal razpis za razvojne projekte za dodatnih 50 milijonov evrov, kar pomeni, če seštejemo, da gre za spodbudo v višini 100-ih milijonov evrov. Moje mnenje je enako predlogu Vlada Republike Slovenije, da se v danem trenutku ne podpre predloga predlagatelja. Hvala."
5,ParlaMint-SI_2014-05-19-SDZ6-Redna-25.u41,SD,-0.97314453125,2014-05-19,0.16179582476615906,"Spoštovana gospa predsednica! Tudi Socialni demokrati smo nezadovoljni z dolgotrajnim postopkov uvajanja tega davka. Eden od razlogov je v neodločnosti in visoki zainteresiranosti finančnega sektorja, da se tej davčni obremenitvi izogne. Če držijo vaši podatki, potem ne razumem, kako je mogoče, da je vaša vlada pravzaprav v dveh različnih časovnih obdobjih radikalno drugače izračunala izplen iz tega davka. Iz dokumenta Vlade Republike Slovenije z dne 9. maja 2013 izhaja, da je finančni izplen tega davka za Slovenijo 10 milijonov evrov in ne 3 milijone evrov. Od kod je prišlo do tako radikalnega znižanja obetov finančnega izplena iz tega davka? Če pa je problem v njegovi ekonomski smiselnosti, spoštovana gospa predsednica, pa bi veljalo razmisliti o tem, da se skladno s stališčem, ki ste ga citirali, to je široka davčna osnova in nizke davčne stopnje, vendarle revidirajo stopnje. Sam ne razumem, kako je mogoče, da je po planu direktive, da so finančni instrumenti obdavčeni z 0,1- odstotno davčno stopnjo, izvedeni finančni instrumenti pa s stopnjo 0,01 %. Naj pri tem spomnim, da je finančno krizo pravzaprav povzročilo trgovanje z izvedenimi finančnimi instrumenti, v katere so pravzaprav velike investicijske banke pakirale različne finančne produkte, bonitetne agencije pa jih neodgovorno ocenile po najvišjih bonitetnih ocenah. Premislek o uvajanju davka na finančne transakcije mora slediti večji odgovornosti finančnega sektorja, predvsem pa temu, da tudi davčne stopnje nastavimo tako, da finančni sektor deli ta bremena in da lahko v širši odgovornosti do družbe prispeva k obnovi družbe in [[…]] [[izklop mikrofona]]"
5,ParlaMint-SI_2009-05-20-SDZ5-Redna-06.u112,OTHER,0.9208984375,2009-05-20,0.0850701704621315,"Hvala lepa, predsedujoči za besedo. Pozdrav ministru in sodelavki. Mislim, da je ministrstvo pripravilo pravi zakon, v pravem trenutku in na dober in pravi način. Zato ga bomo v Poslanskem klubu Liberalne demokracije Slovenije podprli. Konkurenca je zagotovo zaželena, lahko bi rekli celo več - nujna na vsakem trgu, saj ima zagotovo ugodne učinke tako na potrošnike, kot tudi na obstoječe in novo prihajajoče ali vstopajoče gospodarske subjekte, s tem pa posredno povezane ugodne učinke na celotno gospodarstvo in s tem družbo v celoti. Varovanje konkurence in njeno vzpostavljanje je zagotovo trajen, nenehen in nikoli dokončan proces. Zagotovo, ne samo v naši državi, kjer imamo tržno gospodarstvo še v fazi razvijanja in nadgradnje in s tem tudi pomen za pravno varovanje konkurence, zagotovo pa se s tem problemom dnevno srečujejo tudi na trgu razvitih in starih članic Evropske unije. Na marsikaterem trgu je pojem učinkovite konkurence zagotovo bolj mit kot realnost. Zato kot šolski primer lahko navedemo področje energetike v Evropski uniji, in to kljub temu da smo v dosedanji liberalizaciji veliko govorili, sprejeli tudi določene ukrepe in tudi Evropska komisija se je trudila za zagotovitev učinkovite konkurence ter vzpostavitev notranjega energetskega trga. Ne glede na dejstvo, da je v naši državi pravno varovanje konkurence nov in razvijajoč pojem, pa zagotovo Urad za varstvo konkurence kot varuhi učinkovitosti konkurence na trgu pri izvajanju svojih nalog ne sme in ne more biti brezzobi tiger. Enostavno, potrebujemo učinkovito pravno in politično ustrezno podprto organizacijo, ki bo delovala v tem cilju, ki smo si ga zadali, da smo, kar se tiče konkurenčnosti, ustrezno pripravljeni, zavarovani. Vlada kot predlagateljica te novele izpostavlja predvsem to, da mora imeti urad takšna pooblastila, da z njimi učinkovito identificira kršitve konkurence na posameznem trgu, ter hkrati ugotavlja, da pooblastila urada, določena v sedaj veljavnem zakonu, ki je začel veljati leto nazaj, tega ne omogočajo v popolnosti, zato je seveda potrebna in zaželena nadgradnja. V Liberalni demokraciji Slovenije se s to oceno Vlade strinjamo in ocenjujemo obravnavano novelo kot zelo potrebno. V poslanski skupini izpostavljamo naslednje vsebinske spremembe in dopolnitve, ki izhajajo iz praktičnih izkušenj, uporabe 1 leto starega zakona. Ključna se nam zdi opredelitev pojma, podatki, ki je nadgrajena z ureditvijo ravnanja glede razkritja podatkov. Nadalje so predlagane dopolnitve členov, ki urejajo organizacijo Urada za varstvo konkurence in sicer glede odločanja o izločitve direktorja. Definirani so zaupni podatki in določene so tudi obveznosti oseb glede varovanja zaupnih podatkov. Izrecno pa so tudi določene možnosti obdelave osebnih podatkov. V zvezi s tem je urejena dolžnost objave pravnomočnih odločb in sklepov urada, s katerimi se postopek končna kar na sami spletni strani urada. V zvezi s preiskavo pa je dodana možnost ugotavljanja identitete oseb, ki se nahajajo v prostorih družbe takrat, ko se tam izvaja preiskava, ter pa seveda opredeljena možnost kaznovanja fizičnih oseb, ki tako preiskavo ovirajo. Dodatno pa je določeno tudi, kdaj se šteje, da podjetje ovira preiskavo in soureja postopek odpustitve in znižanje globe podjetjem, ki vsorno in tako kot je treba sodelujejo z uradom. Kot sem že omenil, se pravno varovanje konkurence v naši državi pospešeno razvija in uveljavlja. Odraz tega je danes tudi obravnava novela zakona o preprečevanju omejevanja konkurence. Visoka konkurenčnost je za Liberalno demokracijo Slovenije slovenski nacionalni interes, zaradi tega bomo Predlog novele zakona o preprečevanju omejevanja konkurence, ki bo predvsem v praktično dnevno in pa uporabno novost našemu vrhu konkurence podprli."
5,ParlaMint-SI_2014-05-20-SDZ6-Redna-25.u34,OTHER,0.8125,2014-05-20,0.0955464169383049,"Hvala lepa za besedo, gospod predsednik. Spoštovana visoka predstavnika ministrstva za gospodarski razvoj, spoštovani kolegice in kolegi! Mislim, da je ta amandma, ki je podan, zelo dober, dober za gospodarstvo, dober za potrošnike, in jaz osebno ga bom podprl. V svetu je mnogo razvoja, tudi razvoj na področju novih oblik prodaje, in zakonodaja je živa stvar, ki se mora spreminjati. Na drugi strani Slovenija ni več zaprta v enotni prostor, ampak ima odprte meje v Evropi. Ker ima odprte meje, se morajo ta pravila v Evropi počasi izenačiti. Na drugi strani mislim, da se da tudi nekaj naučiti iz tega. Tisto, kar vedno govorimo, da v Sloveniji zelo zakompliciramo, predlog, ki pride iz evropske direktive, in tu je ravno ta primer. Ta člen, ki je bil sprejet na Odboru za gospodarstvo, 6. člen, je zelo zakompliciral prodajo predvsem tistih prodajalcev, ki želijo ustreči določenim kupcem, da dobijo določen proizvod na neobičajen način, na neorganiziran način, in da zakon podpira samo eno zvrst, druge pa ne, je precej narobe. In če bi sprejeli ta člen odbora, potem bi morali predvsem kupcu poleg teh informacij iz 25. člena tega zakona zagotoviti tudi celo vrsto drugih informacij iz šestih, sedmih členov tega zakona, kot je o stroških, povezanih z uporabo komunikacijskega sredstva, o pogojih, rokih in postopku za uveljavljanje pravice do odstopa od pogodbe v skladu z zakonom, skupaj z obrazcem za odstop od pogodbe, o naslovu, na katerem podjetje dejansko opravlja dejavnost in tako naprej. Za enkratno prodajo ali občasno prodajo vse te informacije pripraviti in dati kupcu, je izredno velika administrativna ovira. To pomeni, da se manjša potrošnja; če se manjša potrošnja, se manjša gospodarska rast. Zato bom ta amandma podprl, ker je zelo dober. Hvala."
5,ParlaMint-SI_2006-03-30-SDZ4-Redna-15.u36,OTHER,0.80908203125,2006-03-30,0.07424041628837585,"Hvala lepa, gospod predsedujoči. Gospod državni sekretar, gospa Bornikova, poslanke in poslanci, odsotne poslanke in pa prisotni poslanci. Liberalna demokracije Slovenije, poslanski klub podpira namen tega zakona, ker se naj bi s tem zakonom zagotovil obvladovanje tveganj, ki so povezana s poslovanjem nadzorovanih oseb finančnih konglomeratov. Tako se naj bi zagotovila večja stabilnost finančnega sektorja. S sodelovanjem pristojnih nadzornih organov in pa koordinatorja se naj bi povečalo učinkovitost nadzora nad nadzorovanimi osebami iz različnih finančnih sektorjev, kadar so le-te del finančnega konglomerata. Prav tako se naj bi povečala preglednost in varnost delovanja finančnega trga v Republiki Sloveniji kot sestavnega dela enotnega finančnega trga. Vse to pravim v pogojniku zato, ker se bojimo, da s pravzaprav hitro razpravo in pa hitrim sprejemanjem tega zakona, ki smo ga sicer na matičnem delovnem telesu nekoliko spremenili, ne bomo v polni meri uspeli implementirati določil direktive o dopolnilnem nadzoru kreditnih institucij. To še posebej velja, ker je potrebno dopolniti veljavni in v praksi premalo uporabljen posamični in konsolidiran nadzor nadzorovanih oseb, še posebej to v Sloveniji velja za posamezne družbe, ki deluje na ali v povezavi s trgom vrednostnih papirjev. Tukaj mislimo predvsem na borzno posredniške družbe in družbe za upravljanje. V Liberalni demokraciji podpiramo načela zakona, kot so načelo transparentnosti, načelo preprečevanja dvojnega ali večkratnega štetja kapitala, načelo zmanjševanja tveganja negativnih medsebojnih vplivov in predvsem poudarjamo načelo zaščite potrošnikov, še posebej v tej povezavi tudi načelo zaščite malih delničarjev in načela enakovrednega nadzora v tretjih državah, še posebej, ker je v Sloveniji seveda značilnost slovenskih finančnih inštitucij, da morajo zaradi omejenega domačega trga delovati v tujini. Vendar nam vsa ta načela in zakonodaja ne pomaga nič, če najprej država ne vzpostavlja enakih pogojev. Bom dal primer. V Sloveniji imamo določene družbe, finančne, pravne naslednice nekdanjih PID-ov, ki za razliko od drugih lahko opravijo določene posle. Povedati bi bilo dobro ali pa slišati bi bilo dobro s strani predstavnikov vlade, zakaj je lahko KD Group od Holdinga Slovenskih elektrarn odkupila oziroma zakaj je Holding Slovenskih elektrarn kot KD Group bil pripravljen odkupiti vrednosti delnice v nekaterih družbah Holdinga Slovenskih elektrarn. To bi bilo dobro povedati. Namreč, nič nam ne pomagati sprejemati zakon o finančnih konglomeratih, če vlada, država, institucije paradržave so prve, ki kršijo načela enakopravnih pravil trga. Drugo, zaradi česar imamo seveda problem s tem zakonom in zaradi česar mislimo, da bodo ta načela samo načeloma izpolnjevana in zakon bo le v pogojniku dosegal cilje, je pa v tem, da nam predlagatelji na sami seji matičnega delovnega telesa - upam, da bo to danes povedano - niso bili sposobni razložiti pri dani strukturi, pri dani lastniški strukturi dveh največjih finančnih institucij, največje banke in največje zavarovalnice, se pravi, v primeru, če bi se združila Nova ljubljanska banka, delniška družba, in Zavarovalnica Triglav z vsemi obstoječimi pravnimi lastniki ali eventualnimi njihovimi spremembami, kdo bi bil nadzornik in kdo bi bil koordinator. Zavedamo se, da ta vlada nima namena oblikovanja združenega nadzornika za finančne konglomerate in zato seveda ocenjujemo, da se bodo v praksi pojavljale dileme, katera nadzorna inštitucija bo imela prednost pred drugo. V prejšnji točki smo z zakonom o Banki Slovenije razpravo o tem, kdo je regulator za banke, zaprli. Upamo, da pa bodo te dosedanje odvisne institucije tudi v nadaljevanju kljub netransparentnemu delovanje vlade Republike Slovenije ostale neodvisne. Hvala lepa."
